about,title,date_value,search_url,
1660325,Procurement Bill [Lords]: Motion to disagree with Lords Amendment 102B,13/09/2023,https://hansard.parliament.uk/search/Divisions?startDate=2023-09-13&endDate=2023-09-13&searchTerm=Procuremen&house=Commons&includeCommitteeDivisions=False&partial=False&sortOrder=1,Procurement Bill [Lords] 2023-09-13.txt
1660363,Economic Crime and Corporate Transparency Bill: Motion to disagree with 151B and 151C and to insist on 151A,13/09/2023,https://hansard.parliament.uk/search/Divisions?startDate=2023-09-13&endDate=2023-09-13&searchTerm=Economic C&house=Commons&includeCommitteeDivisions=False&partial=False&sortOrder=1,Economic Crime and Corporate Transparency Bill 2023-09-13.txt
1660364,Draft Windsor Framework (Enforcement etc.) Regulations 2023,13/09/2023,https://hansard.parliament.uk/search/Divisions?startDate=2023-09-13&endDate=2023-09-13&searchTerm=Draft Wind&house=Commons&includeCommitteeDivisions=False&partial=False&sortOrder=1,
1659952,Representation of the People (Postal and Proxy Voting etc.) (Amendment) Regulations 2023,12/09/2023,https://hansard.parliament.uk/search/Divisions?startDate=2023-09-12&endDate=2023-09-12&searchTerm=Representa&house=Commons&includeCommitteeDivisions=False&partial=False&sortOrder=1,
1659953,Misuse of Drugs Act 1971 (Amendment) Order 2023,12/09/2023,https://hansard.parliament.uk/search/Divisions?startDate=2023-09-12&endDate=2023-09-12&searchTerm=Misuse of &house=Commons&includeCommitteeDivisions=False&partial=False&sortOrder=1,Dangerous Drugs 2023-09-12.txt
1658500,Northern Ireland Troubles (legacy and Reconciliation) Bill: Motion to disagree,06/09/2023,https://hansard.parliament.uk/search/Divisions?startDate=2023-09-06&endDate=2023-09-06&searchTerm=Northern I&house=Commons&includeCommitteeDivisions=False&partial=False&sortOrder=1,Northern Ireland Troubles  (Legacy and Reconciliation) Bill 2023-09-06.txt
1658539,Opposition day: Safety of School Buildings,06/09/2023,https://hansard.parliament.uk/search/Divisions?startDate=2023-09-06&endDate=2023-09-06&searchTerm=Opposition&house=Commons&includeCommitteeDivisions=False&partial=False&sortOrder=1,Safety of School Buildings 2023-09-06.txt
1658092,Energy Bill [Lords] Report Stage: New Clause 12,05/09/2023,https://hansard.parliament.uk/search/Divisions?startDate=2023-09-05&endDate=2023-09-05&searchTerm=Energy Bil&house=Commons&includeCommitteeDivisions=False&partial=False&sortOrder=1,Energy Bill [Lords] 2023-09-05.txt
1658093,Energy Bill [Lords] Report Stage: New Clause 39,05/09/2023,https://hansard.parliament.uk/search/Divisions?startDate=2023-09-05&endDate=2023-09-05&searchTerm=Energy Bil&house=Commons&includeCommitteeDivisions=False&partial=False&sortOrder=1,Energy Bill [Lords] 2023-09-05.txt
1658094,Energy Bill [Lords] Report Stage: New Clause 57,05/09/2023,https://hansard.parliament.uk/search/Divisions?startDate=2023-09-05&endDate=2023-09-05&searchTerm=Energy Bil&house=Commons&includeCommitteeDivisions=False&partial=False&sortOrder=1,Energy Bill [Lords] 2023-09-05.txt
1658096,Energy Bill [Lords] Report Stage: New Clause 59,05/09/2023,https://hansard.parliament.uk/search/Divisions?startDate=2023-09-05&endDate=2023-09-05&searchTerm=Energy Bil&house=Commons&includeCommitteeDivisions=False&partial=False&sortOrder=1,Energy Bill [Lords] 2023-09-05.txt
1658097,Energy Bill [Lords] Report Stage: New Clause 61,05/09/2023,https://hansard.parliament.uk/search/Divisions?startDate=2023-09-05&endDate=2023-09-05&searchTerm=Energy Bil&house=Commons&includeCommitteeDivisions=False&partial=False&sortOrder=1,Energy Bill [Lords] 2023-09-05.txt
1658099,Energy Bill [Lords]: Third Reading,05/09/2023,https://hansard.parliament.uk/search/Divisions?startDate=2023-09-05&endDate=2023-09-05&searchTerm=Energy Bil&house=Commons&includeCommitteeDivisions=False&partial=False&sortOrder=1,Energy Bill [Lords] 2023-09-05.txt
1657545,Economic Crime and Corporate Transparency Bill: Amendment (a) to Lords Amendment 23,04/09/2023,https://hansard.parliament.uk/search/Divisions?startDate=2023-09-04&endDate=2023-09-04&searchTerm=Economic C&house=Commons&includeCommitteeDivisions=False&partial=False&sortOrder=1,Economic Crime and Corporate Transparency Bill 2023-09-04.txt
1657546,Economic Crime and Corporate Transparency Bill: Amendment (a) to Lords Amendment 151,04/09/2023,https://hansard.parliament.uk/search/Divisions?startDate=2023-09-04&endDate=2023-09-04&searchTerm=Economic C&house=Commons&includeCommitteeDivisions=False&partial=False&sortOrder=1,Economic Crime and Corporate Transparency Bill 2023-09-04.txt
1657547,Economic Crime and Corporate Transparency Bill: Motion to disagree with Lords Amendment 117,04/09/2023,https://hansard.parliament.uk/search/Divisions?startDate=2023-09-04&endDate=2023-09-04&searchTerm=Economic C&house=Commons&includeCommitteeDivisions=False&partial=False&sortOrder=1,Economic Crime and Corporate Transparency Bill 2023-09-04.txt
1657548,Economic Crime and Corporate Transparency Bill: Motion to disagree with Lords Amendment 159,04/09/2023,https://hansard.parliament.uk/search/Divisions?startDate=2023-09-04&endDate=2023-09-04&searchTerm=Economic C&house=Commons&includeCommitteeDivisions=False&partial=False&sortOrder=1,Economic Crime and Corporate Transparency Bill 2023-09-04.txt
1657549,Economic Crime and Corporate Transparency Bill: Motion to disagree with Lords Amendment 161,04/09/2023,https://hansard.parliament.uk/search/Divisions?startDate=2023-09-04&endDate=2023-09-04&searchTerm=Economic C&house=Commons&includeCommitteeDivisions=False&partial=False&sortOrder=1,Economic Crime and Corporate Transparency Bill 2023-09-04.txt
1653778,Northern Ireland Troubles (Legacy and Reconciliation) Bill: Motion to disagree with Lords Amendment 44 ,18/07/2023,https://hansard.parliament.uk/search/Divisions?startDate=2023-07-18&endDate=2023-07-18&searchTerm=Northern I&house=Commons&includeCommitteeDivisions=False&partial=False&sortOrder=1,Northern Ireland Troubles  (Legacy and Reconciliation) Bill 2023-07-18.txt
1654097,Draft Postal Packets (Miscellaneous Amendments) Order 2023,18/07/2023,https://hansard.parliament.uk/search/Divisions?startDate=2023-07-18&endDate=2023-07-18&searchTerm=Draft Post&house=Commons&includeCommitteeDivisions=False&partial=False&sortOrder=1,
1653326,"Illegal Migration Bill: motion to disagree with Lords Amendments 1B, 7B and 90B",17/07/2023,https://hansard.parliament.uk/search/Divisions?startDate=2023-07-17&endDate=2023-07-17&searchTerm=Illegal Mi&house=Commons&includeCommitteeDivisions=False&partial=False&sortOrder=1,Illegal Migration Bill 2023-07-17.txt
1653333,Illegal Migration Bill: motion to disagree with Lords Amendment 9B,17/07/2023,https://hansard.parliament.uk/search/Divisions?startDate=2023-07-17&endDate=2023-07-17&searchTerm=Illegal Mi&house=Commons&includeCommitteeDivisions=False&partial=False&sortOrder=1,Illegal Migration Bill 2023-07-17.txt
1653334,Illegal Migration Bill: motion to disagree with Lords Amendment 23B,17/07/2023,https://hansard.parliament.uk/search/Divisions?startDate=2023-07-17&endDate=2023-07-17&searchTerm=Illegal Mi&house=Commons&includeCommitteeDivisions=False&partial=False&sortOrder=1,Illegal Migration Bill 2023-07-17.txt
1653335,Illegal Migration Bill: motion to disagree with Lords Amendments 36C and 36D,17/07/2023,https://hansard.parliament.uk/search/Divisions?startDate=2023-07-17&endDate=2023-07-17&searchTerm=Illegal Mi&house=Commons&includeCommitteeDivisions=False&partial=False&sortOrder=1,Illegal Migration Bill 2023-07-17.txt
1653336,Illegal Migration Bill: motion to disagree with Lords Amendment 33B,17/07/2023,https://hansard.parliament.uk/search/Divisions?startDate=2023-07-17&endDate=2023-07-17&searchTerm=Illegal Mi&house=Commons&includeCommitteeDivisions=False&partial=False&sortOrder=1,Illegal Migration Bill 2023-07-17.txt
1653337,Illegal Migration Bill: motion to disagree with Lords Amendment 56B,17/07/2023,https://hansard.parliament.uk/search/Divisions?startDate=2023-07-17&endDate=2023-07-17&searchTerm=Illegal Mi&house=Commons&includeCommitteeDivisions=False&partial=False&sortOrder=1,Illegal Migration Bill 2023-07-17.txt
1653339,Illegal Migration Bill: motion to disagree with Lords Amendment 103B,17/07/2023,https://hansard.parliament.uk/search/Divisions?startDate=2023-07-17&endDate=2023-07-17&searchTerm=Illegal Mi&house=Commons&includeCommitteeDivisions=False&partial=False&sortOrder=1,Illegal Migration Bill 2023-07-17.txt
1653340,Illegal Migration Bill: motion to disagree with Lords Amendment 102B,17/07/2023,https://hansard.parliament.uk/search/Divisions?startDate=2023-07-17&endDate=2023-07-17&searchTerm=Illegal Mi&house=Commons&includeCommitteeDivisions=False&partial=False&sortOrder=1,Illegal Migration Bill 2023-07-17.txt
1653341,Illegal Migration Bill: motion to disagree with Lords Amendments 107B and 107C,17/07/2023,https://hansard.parliament.uk/search/Divisions?startDate=2023-07-17&endDate=2023-07-17&searchTerm=Illegal Mi&house=Commons&includeCommitteeDivisions=False&partial=False&sortOrder=1,Illegal Migration Bill 2023-07-17.txt
1653344,Strikes (Minimum Service Levels) Bill: motion to disagree with Lords Amendment 2D,17/07/2023,https://hansard.parliament.uk/search/Divisions?startDate=2023-07-17&endDate=2023-07-17&searchTerm=Strikes (M&house=Commons&includeCommitteeDivisions=False&partial=False&sortOrder=1,Strikes (Minimum Service Levels) Bill 2023-07-17.txt
1652245,"Adjournment (Summer, Conference and Christmas Recess)",12/07/2023,https://hansard.parliament.uk/search/Divisions?startDate=2023-07-12&endDate=2023-07-12&searchTerm=Adjournmen&house=Commons&includeCommitteeDivisions=False&partial=False&sortOrder=1,"ADJOURNMENT (SUMMER, CONFERENCE AND CHRISTMAS) 2023-07-12.txt"
1651836,Illegal Migration Bill: motion to disagree with Lords Amendment 1,11/07/2023,https://hansard.parliament.uk/search/Divisions?startDate=2023-07-11&endDate=2023-07-11&searchTerm=Illegal Mi&house=Commons&includeCommitteeDivisions=False&partial=False&sortOrder=1,Illegal Migration Bill 2023-07-11.txt
1651837,Illegal Migration Bill: motion to disagree with Lords Amendment 6,11/07/2023,https://hansard.parliament.uk/search/Divisions?startDate=2023-07-11&endDate=2023-07-11&searchTerm=Illegal Mi&house=Commons&includeCommitteeDivisions=False&partial=False&sortOrder=1,Illegal Migration Bill 2023-07-11.txt
1651844,Illegal Migration Bill: motion to disagree with Lords Amendment 8,11/07/2023,https://hansard.parliament.uk/search/Divisions?startDate=2023-07-11&endDate=2023-07-11&searchTerm=Illegal Mi&house=Commons&includeCommitteeDivisions=False&partial=False&sortOrder=1,Illegal Migration Bill 2023-07-11.txt
1651845,Illegal Migration Bill: motion to disagree with Lords Amendment 9,11/07/2023,https://hansard.parliament.uk/search/Divisions?startDate=2023-07-11&endDate=2023-07-11&searchTerm=Illegal Mi&house=Commons&includeCommitteeDivisions=False&partial=False&sortOrder=1,Illegal Migration Bill 2023-07-11.txt
1651846,Illegal Migration Bill: motion to disagree with Lords Amendment 23,11/07/2023,https://hansard.parliament.uk/search/Divisions?startDate=2023-07-11&endDate=2023-07-11&searchTerm=Illegal Mi&house=Commons&includeCommitteeDivisions=False&partial=False&sortOrder=1,Illegal Migration Bill 2023-07-11.txt
1651847,Illegal Migration Bill: motion to disagree with Lords Amendment 31,11/07/2023,https://hansard.parliament.uk/search/Divisions?startDate=2023-07-11&endDate=2023-07-11&searchTerm=Illegal Mi&house=Commons&includeCommitteeDivisions=False&partial=False&sortOrder=1,Illegal Migration Bill 2023-07-11.txt
1651848,Illegal Migration Bill: motion to disagree with Lords Amendment 33,11/07/2023,https://hansard.parliament.uk/search/Divisions?startDate=2023-07-11&endDate=2023-07-11&searchTerm=Illegal Mi&house=Commons&includeCommitteeDivisions=False&partial=False&sortOrder=1,Illegal Migration Bill 2023-07-11.txt
1651849,"Illegal Migration Bill: Government Amendments (a) and (b) in lieu of Lords Amendments 31, 35 & 36",11/07/2023,https://hansard.parliament.uk/search/Divisions?startDate=2023-07-11&endDate=2023-07-11&searchTerm=Illegal Mi&house=Commons&includeCommitteeDivisions=False&partial=False&sortOrder=1,Illegal Migration Bill 2023-07-11.txt
1651850,Illegal Migration Bill: motion to disagree with Lords Amendment 39,11/07/2023,https://hansard.parliament.uk/search/Divisions?startDate=2023-07-11&endDate=2023-07-11&searchTerm=Illegal Mi&house=Commons&includeCommitteeDivisions=False&partial=False&sortOrder=1,Illegal Migration Bill 2023-07-11.txt
1651851,Illegal Migration Bill: motion to disagree with Lords Amendment 50,11/07/2023,https://hansard.parliament.uk/search/Divisions?startDate=2023-07-11&endDate=2023-07-11&searchTerm=Illegal Mi&house=Commons&includeCommitteeDivisions=False&partial=False&sortOrder=1,Illegal Migration Bill 2023-07-11.txt
1651909,Illegal Migration Bill: motion to disagree with Lords Amendment 56,11/07/2023,https://hansard.parliament.uk/search/Divisions?startDate=2023-07-11&endDate=2023-07-11&searchTerm=Illegal Mi&house=Commons&includeCommitteeDivisions=False&partial=False&sortOrder=1,Illegal Migration Bill 2023-07-11.txt
1651910,Illegal Migration Bill: motion to disagree with Lords Amendment 73,11/07/2023,https://hansard.parliament.uk/search/Divisions?startDate=2023-07-11&endDate=2023-07-11&searchTerm=Illegal Mi&house=Commons&includeCommitteeDivisions=False&partial=False&sortOrder=1,Illegal Migration Bill 2023-07-11.txt
1651911,Illegal Migration Bill: motion to disagree with Lords Amendment 90,11/07/2023,https://hansard.parliament.uk/search/Divisions?startDate=2023-07-11&endDate=2023-07-11&searchTerm=Illegal Mi&house=Commons&includeCommitteeDivisions=False&partial=False&sortOrder=1,Illegal Migration Bill 2023-07-11.txt
1651913,Illegal Migration Bill: motion to disagree with Lords Amendment 93,11/07/2023,https://hansard.parliament.uk/search/Divisions?startDate=2023-07-11&endDate=2023-07-11&searchTerm=Illegal Mi&house=Commons&includeCommitteeDivisions=False&partial=False&sortOrder=1,Illegal Migration Bill 2023-07-11.txt
1651914,Illegal Migration Bill: motion to disagree with Lords Amendment 95,11/07/2023,https://hansard.parliament.uk/search/Divisions?startDate=2023-07-11&endDate=2023-07-11&searchTerm=Illegal Mi&house=Commons&includeCommitteeDivisions=False&partial=False&sortOrder=1,Illegal Migration Bill 2023-07-11.txt
1651916,Illegal Migration Bill: motion to disagree with Lords Amendment 102,11/07/2023,https://hansard.parliament.uk/search/Divisions?startDate=2023-07-11&endDate=2023-07-11&searchTerm=Illegal Mi&house=Commons&includeCommitteeDivisions=False&partial=False&sortOrder=1,Illegal Migration Bill 2023-07-11.txt
1651917,Illegal Migration Bill: motion to disagree with Lords Amendment 103,11/07/2023,https://hansard.parliament.uk/search/Divisions?startDate=2023-07-11&endDate=2023-07-11&searchTerm=Illegal Mi&house=Commons&includeCommitteeDivisions=False&partial=False&sortOrder=1,Illegal Migration Bill 2023-07-11.txt
1651919,Illegal Migration Bill: motion to disagree with Lords Amendment 104,11/07/2023,https://hansard.parliament.uk/search/Divisions?startDate=2023-07-11&endDate=2023-07-11&searchTerm=Illegal Mi&house=Commons&includeCommitteeDivisions=False&partial=False&sortOrder=1,Illegal Migration Bill 2023-07-11.txt
1649487,Economic Activity of Public Bodies (Overseas Matters) Bill: Reasoned Amendment on Second Reading,03/07/2023,https://hansard.parliament.uk/search/Divisions?startDate=2023-07-03&endDate=2023-07-03&searchTerm=Economic A&house=Commons&includeCommitteeDivisions=False&partial=False&sortOrder=1,Economic Activity of Public Bodies (Overseas Matters) Bill 2023-07-03.txt
1649541,Economic Activity of Public Bodies (Overseas Matters): Second Reading,03/07/2023,https://hansard.parliament.uk/search/Divisions?startDate=2023-07-03&endDate=2023-07-03&searchTerm=Economic A&house=Commons&includeCommitteeDivisions=False&partial=False&sortOrder=1,Economic Activity of Public Bodies (Overseas Matters) Bill 2023-07-03.txt
1648435,Relationships and Sexuality Education (Northern Ireland) (Amendment) Regulations 2023,28/06/2023,https://hansard.parliament.uk/search/Divisions?startDate=2023-06-28&endDate=2023-06-28&searchTerm=Relationsh&house=Commons&includeCommitteeDivisions=False&partial=False&sortOrder=1,
1648454,Holocaust Memorial Bill: Instruction (Amendment a),28/06/2023,https://hansard.parliament.uk/search/Divisions?startDate=2023-06-28&endDate=2023-06-28&searchTerm=Holocaust &house=Commons&includeCommitteeDivisions=False&partial=False&sortOrder=1,Holocaust Memorial Bill_ Committal 2023-06-28.txt
1647995,Schools (Gender and Parental Rights): Ten-Minute Rule Bill,27/06/2023,https://hansard.parliament.uk/search/Divisions?startDate=2023-06-27&endDate=2023-06-27&searchTerm=Schools (G&house=Commons&includeCommitteeDivisions=False&partial=False&sortOrder=1,Schools (Gender and Parental Rights) 2023-06-27.txt
1648052,Opposition day: Mortgage and rental costs,27/06/2023,https://hansard.parliament.uk/search/Divisions?startDate=2023-06-27&endDate=2023-06-27&searchTerm=Opposition&house=Commons&includeCommitteeDivisions=False&partial=False&sortOrder=1,
1648055,Government Amendment to Opposition day debate on Mortgage and rental costs,27/06/2023,https://hansard.parliament.uk/search/Divisions?startDate=2023-06-27&endDate=2023-06-27&searchTerm=Government&house=Commons&includeCommitteeDivisions=False&partial=False&sortOrder=1,
1647632,Financial Services and Markets Bill: motion to disagree with Lords Amendment 7,26/06/2023,https://hansard.parliament.uk/search/Divisions?startDate=2023-06-26&endDate=2023-06-26&searchTerm=Financial &house=Commons&includeCommitteeDivisions=False&partial=False&sortOrder=1,Financial Services and Markets Bill 2023-06-26.txt
1647634,Financial Services and Markets Bill: motion to disagree with Lords Amendment 10,26/06/2023,https://hansard.parliament.uk/search/Divisions?startDate=2023-06-26&endDate=2023-06-26&searchTerm=Financial &house=Commons&includeCommitteeDivisions=False&partial=False&sortOrder=1,Financial Services and Markets Bill 2023-06-26.txt
1647635,Financial Services and Markets Bill: motion to agree with Lords Amendment 38,26/06/2023,https://hansard.parliament.uk/search/Divisions?startDate=2023-06-26&endDate=2023-06-26&searchTerm=Financial &house=Commons&includeCommitteeDivisions=False&partial=False&sortOrder=1,Financial Services and Markets Bill 2023-06-26.txt
1647693,National Security Bill: motion to disagree with Lords Amendment 22B,26/06/2023,https://hansard.parliament.uk/search/Divisions?startDate=2023-06-26&endDate=2023-06-26&searchTerm=National S&house=Commons&includeCommitteeDivisions=False&partial=False&sortOrder=1,National Security Bill 2023-06-26.txt
1646218,Strikes (Minimum Service Levels) Bill: motion to disagree with Lords Amendment 2B,21/06/2023,https://hansard.parliament.uk/search/Divisions?startDate=2023-06-21&endDate=2023-06-21&searchTerm=Strikes (M&house=Commons&includeCommitteeDivisions=False&partial=False&sortOrder=1,
1646219,Strikes (Minimum Service Levels) Bill: motion to disagree with Lords Amendment 4B,21/06/2023,https://hansard.parliament.uk/search/Divisions?startDate=2023-06-21&endDate=2023-06-21&searchTerm=Strikes (M&house=Commons&includeCommitteeDivisions=False&partial=False&sortOrder=1,
1646220,"Strikes (Minimum Service Levels) Bill: motion to disagree with Lords Amendments 5B, 5C and 5D",21/06/2023,https://hansard.parliament.uk/search/Divisions?startDate=2023-06-21&endDate=2023-06-21&searchTerm=Strikes (M&house=Commons&includeCommitteeDivisions=False&partial=False&sortOrder=1,
1646259,Retained EU Law (Revocation and Reform) Bill Lords Message: motion to disagree with Lords Amendment 15D ,21/06/2023,https://hansard.parliament.uk/search/Divisions?startDate=2023-06-21&endDate=2023-06-21&searchTerm=Retained E&house=Commons&includeCommitteeDivisions=False&partial=False&sortOrder=1,Retained EU Law  (Revocation and Reform) Bill 2023-06-21.txt
1646260,Retained EU Law (Revocation and Reform) Bill Lords Message: motion to disagree with Lords Amendment 42D,21/06/2023,https://hansard.parliament.uk/search/Divisions?startDate=2023-06-21&endDate=2023-06-21&searchTerm=Retained E&house=Commons&includeCommitteeDivisions=False&partial=False&sortOrder=1,Retained EU Law  (Revocation and Reform) Bill 2023-06-21.txt
1646266,Opposition Day: Animal Welfare (Kept Animals),21/06/2023,https://hansard.parliament.uk/search/Divisions?startDate=2023-06-21&endDate=2023-06-21&searchTerm=Opposition&house=Commons&includeCommitteeDivisions=False&partial=False&sortOrder=1,
1646267,Government Amendment to Opposition day debate on Animal Welfare (Kept Animals),21/06/2023,https://hansard.parliament.uk/search/Divisions?startDate=2023-06-21&endDate=2023-06-21&searchTerm=Government&house=Commons&includeCommitteeDivisions=False&partial=False&sortOrder=1,
1645861,Finance (No. 2) Bill Report Stage: New Clause 7,20/06/2023,https://hansard.parliament.uk/search/Divisions?startDate=2023-06-20&endDate=2023-06-20&searchTerm=Finance (N&house=Commons&includeCommitteeDivisions=False&partial=False&sortOrder=1,Finance (No. 2) Bill 2023-06-20.txt
1645863,Finance (No. 2) Bill Report Stage: Amendment 1,20/06/2023,https://hansard.parliament.uk/search/Divisions?startDate=2023-06-20&endDate=2023-06-20&searchTerm=Finance (N&house=Commons&includeCommitteeDivisions=False&partial=False&sortOrder=1,Finance (No. 2) Bill 2023-06-20.txt
1645545,Privilege Motion,19/06/2023,https://hansard.parliament.uk/search/Divisions?startDate=2023-06-19&endDate=2023-06-19&searchTerm=Privilege &house=Commons&includeCommitteeDivisions=False&partial=False&sortOrder=1,Privilege_ Conduct of  Right Hon. Boris Johnson 2023-06-19.txt
1644573,"Draft Animal By-Products, Pet Passport and Animal Health (Fees) (England) (Amendment) Regulations 2023",14/06/2023,https://hansard.parliament.uk/search/Divisions?startDate=2023-06-14&endDate=2023-06-14&searchTerm=Draft Anim&house=Commons&includeCommitteeDivisions=False&partial=False&sortOrder=1,
1644574,Opposition Day: Cost of living and Brexit,14/06/2023,https://hansard.parliament.uk/search/Divisions?startDate=2023-06-14&endDate=2023-06-14&searchTerm=Opposition&house=Commons&includeCommitteeDivisions=False&partial=False&sortOrder=1,
1644021,Procurement Bill [Lords] Report Stage: New Clause 10 ,13/06/2023,https://hansard.parliament.uk/search/Divisions?startDate=2023-06-13&endDate=2023-06-13&searchTerm=Procuremen&house=Commons&includeCommitteeDivisions=False&partial=False&sortOrder=1,Procurement Bill [Lords] 2023-06-13.txt
1644022,Procurement Bill [Lords] Report Stage: Amendment 2,13/06/2023,https://hansard.parliament.uk/search/Divisions?startDate=2023-06-13&endDate=2023-06-13&searchTerm=Procuremen&house=Commons&includeCommitteeDivisions=False&partial=False&sortOrder=1,Procurement Bill [Lords] 2023-06-13.txt
1644023,Procurement Bill [Lords] Report Stage: Amendment 18 ,13/06/2023,https://hansard.parliament.uk/search/Divisions?startDate=2023-06-13&endDate=2023-06-13&searchTerm=Procuremen&house=Commons&includeCommitteeDivisions=False&partial=False&sortOrder=1,Procurement Bill [Lords] 2023-06-13.txt
1644024,Procurement Bill [Lords] Report Stage: Amendment 3,13/06/2023,https://hansard.parliament.uk/search/Divisions?startDate=2023-06-13&endDate=2023-06-13&searchTerm=Procuremen&house=Commons&includeCommitteeDivisions=False&partial=False&sortOrder=1,Procurement Bill [Lords] 2023-06-13.txt
1643554,Motion to disagree with Lords Amendment 15B,12/06/2023,https://hansard.parliament.uk/search/Divisions?startDate=2023-06-12&endDate=2023-06-12&searchTerm=Motion to &house=Commons&includeCommitteeDivisions=False&partial=False&sortOrder=1,
1643559,Motion to disagree with Lords Amendment 42B,12/06/2023,https://hansard.parliament.uk/search/Divisions?startDate=2023-06-12&endDate=2023-06-12&searchTerm=Motion to &house=Commons&includeCommitteeDivisions=False&partial=False&sortOrder=1,
1643561,That the draft Public Order Act 1986 (Serious Disruption to the Life of the Community) Regulations 2023 be approved,12/06/2023,https://hansard.parliament.uk/search/Divisions?startDate=2023-06-12&endDate=2023-06-12&searchTerm=That the d&house=Commons&includeCommitteeDivisions=False&partial=False&sortOrder=1,
1642491,Opposition Day: Mental health treatment and support,07/06/2023,https://hansard.parliament.uk/search/Divisions?startDate=2023-06-07&endDate=2023-06-07&searchTerm=Opposition&house=Commons&includeCommitteeDivisions=False&partial=False&sortOrder=1,
1642492,Opposition Day: Mental health treatment and support: Government amendment,07/06/2023,https://hansard.parliament.uk/search/Divisions?startDate=2023-06-07&endDate=2023-06-07&searchTerm=Opposition&house=Commons&includeCommitteeDivisions=False&partial=False&sortOrder=1,
1642505,Opposition day: Accountability and scrutiny of Teesworks,07/06/2023,https://hansard.parliament.uk/search/Divisions?startDate=2023-06-07&endDate=2023-06-07&searchTerm=Opposition&house=Commons&includeCommitteeDivisions=False&partial=False&sortOrder=1,
1642042,Committee on Standards Motion,06/06/2023,https://hansard.parliament.uk/search/Divisions?startDate=2023-06-06&endDate=2023-06-06&searchTerm=Committee &house=Commons&includeCommitteeDivisions=False&partial=False&sortOrder=1,Committee on Standards 2023-06-06.txt
1639952,Retained EU Law (Revocation and Reform) Bill: motion to disagree with Lords Amendment  Lords Amendment 6,24/05/2023,https://hansard.parliament.uk/search/Divisions?startDate=2023-05-24&endDate=2023-05-24&searchTerm=Retained E&house=Commons&includeCommitteeDivisions=False&partial=False&sortOrder=1,Retained EU Law  (Revocation and Reform) Bill 2023-05-24.txt
1639953,Retained EU Law (Revocation and Reform) Bill: Amendment (a) to Lords Amendment 1,24/05/2023,https://hansard.parliament.uk/search/Divisions?startDate=2023-05-24&endDate=2023-05-24&searchTerm=Retained E&house=Commons&includeCommitteeDivisions=False&partial=False&sortOrder=1,Retained EU Law  (Revocation and Reform) Bill 2023-05-24.txt
1639957,Retained EU Law (Revocation and Reform) Bill: motion to disagree with Lords Amendment 42,24/05/2023,https://hansard.parliament.uk/search/Divisions?startDate=2023-05-24&endDate=2023-05-24&searchTerm=Retained E&house=Commons&includeCommitteeDivisions=False&partial=False&sortOrder=1,Retained EU Law  (Revocation and Reform) Bill 2023-05-24.txt
1640181,Retained EU Law (Revocation and Reform) Bill: motion to disagree with Lords Amendment 15,24/05/2023,https://hansard.parliament.uk/search/Divisions?startDate=2023-05-24&endDate=2023-05-24&searchTerm=Retained E&house=Commons&includeCommitteeDivisions=False&partial=False&sortOrder=1,Retained EU Law  (Revocation and Reform) Bill 2023-05-24.txt
1639556,Opposition Day - Leasehold,23/05/2023,https://hansard.parliament.uk/search/Divisions?startDate=2023-05-23&endDate=2023-05-23&searchTerm=Opposition&house=Commons&includeCommitteeDivisions=False&partial=False&sortOrder=1,
1639569,Opposition Day: Safety of School Buildings,23/05/2023,https://hansard.parliament.uk/search/Divisions?startDate=2023-05-23&endDate=2023-05-23&searchTerm=Opposition&house=Commons&includeCommitteeDivisions=False&partial=False&sortOrder=1,
1639171,Non-Domestic Rating Bill Committee: Amendment 20,22/05/2023,https://hansard.parliament.uk/search/Divisions?startDate=2023-05-22&endDate=2023-05-22&searchTerm=Non-Domest&house=Commons&includeCommitteeDivisions=False&partial=False&sortOrder=1,Non-Domestic Rating Bill 2023-05-22.txt
1639178,Strikes (Minimum Service Levels) Bill: motion to disagree with Lords Amendment 1,22/05/2023,https://hansard.parliament.uk/search/Divisions?startDate=2023-05-22&endDate=2023-05-22&searchTerm=Strikes (M&house=Commons&includeCommitteeDivisions=False&partial=False&sortOrder=1,Strikes (Minimum Service Levels) Bill 2023-05-22.txt
1639181,Strikes (Minimum Service Levels) Bill: motion to disagree with Lords Amendment 2,22/05/2023,https://hansard.parliament.uk/search/Divisions?startDate=2023-05-22&endDate=2023-05-22&searchTerm=Strikes (M&house=Commons&includeCommitteeDivisions=False&partial=False&sortOrder=1,Strikes (Minimum Service Levels) Bill 2023-05-22.txt
1639183,Strikes (Minimum Service Levels) Bill: motion to disagree with Lords Amendment 4,22/05/2023,https://hansard.parliament.uk/search/Divisions?startDate=2023-05-22&endDate=2023-05-22&searchTerm=Strikes (M&house=Commons&includeCommitteeDivisions=False&partial=False&sortOrder=1,Strikes (Minimum Service Levels) Bill 2023-05-22.txt
1639186,Strikes (Minimum Service Levels) Bill: motion to disagree with Lords Amendment 5,22/05/2023,https://hansard.parliament.uk/search/Divisions?startDate=2023-05-22&endDate=2023-05-22&searchTerm=Strikes (M&house=Commons&includeCommitteeDivisions=False&partial=False&sortOrder=1,Strikes (Minimum Service Levels) Bill 2023-05-22.txt
1627999,Opposition Day: Cost of living,16/05/2023,https://hansard.parliament.uk/search/Divisions?startDate=2023-05-16&endDate=2023-05-16&searchTerm=Opposition&house=Commons&includeCommitteeDivisions=False&partial=False&sortOrder=1,
1628002,Opposition Day: Cost of living: Government Amendment,16/05/2023,https://hansard.parliament.uk/search/Divisions?startDate=2023-05-16&endDate=2023-05-16&searchTerm=Opposition&house=Commons&includeCommitteeDivisions=False&partial=False&sortOrder=1,
1628010,Opposition Day: Repeal of the Public Order Act 2023,16/05/2023,https://hansard.parliament.uk/search/Divisions?startDate=2023-05-16&endDate=2023-05-16&searchTerm=Opposition&house=Commons&includeCommitteeDivisions=False&partial=False&sortOrder=1,
1625576,National Security Bill: Amendment (c) to Lords Amendment 26,03/05/2023,https://hansard.parliament.uk/search/Divisions?startDate=2023-05-03&endDate=2023-05-03&searchTerm=National S&house=Commons&includeCommitteeDivisions=False&partial=False&sortOrder=1,National Security Bill 2023-05-03.txt
1625578,National Security Bill: motion to disagree with Lords Amendment 22,03/05/2023,https://hansard.parliament.uk/search/Divisions?startDate=2023-05-03&endDate=2023-05-03&searchTerm=National S&house=Commons&includeCommitteeDivisions=False&partial=False&sortOrder=1,National Security Bill 2023-05-03.txt
1625579,National Security Bill: motion to disagree with Lords Amendment 122,03/05/2023,https://hansard.parliament.uk/search/Divisions?startDate=2023-05-03&endDate=2023-05-03&searchTerm=National S&house=Commons&includeCommitteeDivisions=False&partial=False&sortOrder=1,National Security Bill 2023-05-03.txt
1625585,Lifelong Learning (Higher Education Fee Limits) Bill Report Stage: New Clause 1,03/05/2023,https://hansard.parliament.uk/search/Divisions?startDate=2023-05-03&endDate=2023-05-03&searchTerm=Lifelong L&house=Commons&includeCommitteeDivisions=False&partial=False&sortOrder=1,Lifelong Learning  (Higher Education Fee Limits) Bill 2023-05-03.txt
1623950,Illegal Migration Bill Report Stage: New Clause 9,26/04/2023,https://hansard.parliament.uk/search/Divisions?startDate=2023-04-26&endDate=2023-04-26&searchTerm=Illegal Mi&house=Commons&includeCommitteeDivisions=False&partial=False&sortOrder=1,Illegal Migration Bill 2023-04-26.txt
1623952,Illegal Migration Bill Report Stage: New Clause 10,26/04/2023,https://hansard.parliament.uk/search/Divisions?startDate=2023-04-26&endDate=2023-04-26&searchTerm=Illegal Mi&house=Commons&includeCommitteeDivisions=False&partial=False&sortOrder=1,Illegal Migration Bill 2023-04-26.txt
1623953,Illegal Migration Bill Report Stage: New Clause 15,26/04/2023,https://hansard.parliament.uk/search/Divisions?startDate=2023-04-26&endDate=2023-04-26&searchTerm=Illegal Mi&house=Commons&includeCommitteeDivisions=False&partial=False&sortOrder=1,Illegal Migration Bill 2023-04-26.txt
1623954,Illegal Migration Bill Report Stage: Amendment 45,26/04/2023,https://hansard.parliament.uk/search/Divisions?startDate=2023-04-26&endDate=2023-04-26&searchTerm=Illegal Mi&house=Commons&includeCommitteeDivisions=False&partial=False&sortOrder=1,Illegal Migration Bill 2023-04-26.txt
1623955,Illegal Migration Bill Report Stage: Amendment 2,26/04/2023,https://hansard.parliament.uk/search/Divisions?startDate=2023-04-26&endDate=2023-04-26&searchTerm=Illegal Mi&house=Commons&includeCommitteeDivisions=False&partial=False&sortOrder=1,Illegal Migration Bill 2023-04-26.txt
1623958,Illegal Migration Bill - Third Reading,26/04/2023,https://hansard.parliament.uk/search/Divisions?startDate=2023-04-26&endDate=2023-04-26&searchTerm=Illegal Mi&house=Commons&includeCommitteeDivisions=False&partial=False&sortOrder=1,Illegal Migration Bill 2023-04-26.txt
1623592,Opposition Day: Water quality (sewage discharge): Prime Minister's amendment,25/04/2023,https://hansard.parliament.uk/search/Divisions?startDate=2023-04-25&endDate=2023-04-25&searchTerm=Opposition&house=Commons&includeCommitteeDivisions=False&partial=False&sortOrder=1,
1623594,Opposition Day: Water quality (sewage discharge): motion as amended,25/04/2023,https://hansard.parliament.uk/search/Divisions?startDate=2023-04-25&endDate=2023-04-25&searchTerm=Opposition&house=Commons&includeCommitteeDivisions=False&partial=False&sortOrder=1,
1623604,Opposition Day: Cost of living increases,25/04/2023,https://hansard.parliament.uk/search/Divisions?startDate=2023-04-25&endDate=2023-04-25&searchTerm=Opposition&house=Commons&includeCommitteeDivisions=False&partial=False&sortOrder=1,
1623605,Opposition Day: Cost of living increases: Prime Minister's amendment,25/04/2023,https://hansard.parliament.uk/search/Divisions?startDate=2023-04-25&endDate=2023-04-25&searchTerm=Opposition&house=Commons&includeCommitteeDivisions=False&partial=False&sortOrder=1,
1623208,Public Order Bill: motion to disagree with Lords Amendments 6H & 6J,24/04/2023,https://hansard.parliament.uk/search/Divisions?startDate=2023-04-24&endDate=2023-04-24&searchTerm=Public Ord&house=Commons&includeCommitteeDivisions=False&partial=False&sortOrder=1,Public Order Bill 2023-04-24.txt
1612197,Finance (No. 2) Bill Committee of the whole House: Amendment 21,19/04/2023,https://hansard.parliament.uk/search/Divisions?startDate=2023-04-19&endDate=2023-04-19&searchTerm=Finance (N&house=Commons&includeCommitteeDivisions=False&partial=False&sortOrder=1,Finance (No. 2) Bill 2023-04-19.txt
1612198,Finance (No. 2) Bill Committee of the whole House: Clause 18 stand part,19/04/2023,https://hansard.parliament.uk/search/Divisions?startDate=2023-04-19&endDate=2023-04-19&searchTerm=Finance (N&house=Commons&includeCommitteeDivisions=False&partial=False&sortOrder=1,Finance (No. 2) Bill 2023-04-19.txt
1612199,Finance (No. 2) Bill Committee of the whole House: New Clause 5,19/04/2023,https://hansard.parliament.uk/search/Divisions?startDate=2023-04-19&endDate=2023-04-19&searchTerm=Finance (N&house=Commons&includeCommitteeDivisions=False&partial=False&sortOrder=1,Finance (No. 2) Bill 2023-04-19.txt
1612203,Finance (No. 2) Bill Committee of the whole House: Amendment 7,19/04/2023,https://hansard.parliament.uk/search/Divisions?startDate=2023-04-19&endDate=2023-04-19&searchTerm=Finance (N&house=Commons&includeCommitteeDivisions=False&partial=False&sortOrder=1,Finance (No. 2) Bill 2023-04-19.txt
1611613,Finance (No. 2) Bill Committee of the whole House: New Clause 1,18/04/2023,https://hansard.parliament.uk/search/Divisions?startDate=2023-04-18&endDate=2023-04-18&searchTerm=Finance (N&house=Commons&includeCommitteeDivisions=False&partial=False&sortOrder=1,Finance (No. 2) Bill 2023-04-18.txt
1611617,Finance (No. 2) Bill Committee of the whole House: New Clause 3,18/04/2023,https://hansard.parliament.uk/search/Divisions?startDate=2023-04-18&endDate=2023-04-18&searchTerm=Finance (N&house=Commons&includeCommitteeDivisions=False&partial=False&sortOrder=1,Finance (No. 2) Bill 2023-04-18.txt
1611619,Finance (No. 2) Bill Committee of the whole House: New Clause 6,18/04/2023,https://hansard.parliament.uk/search/Divisions?startDate=2023-04-18&endDate=2023-04-18&searchTerm=Finance (N&house=Commons&includeCommitteeDivisions=False&partial=False&sortOrder=1,Finance (No. 2) Bill 2023-04-18.txt
1608497,Finance (No. 2) Bill: Reasoned Amendment to Second Reading motion,29/03/2023,https://hansard.parliament.uk/search/Divisions?startDate=2023-03-29&endDate=2023-03-29&searchTerm=Finance (N&house=Commons&includeCommitteeDivisions=False&partial=False&sortOrder=1,Finance (No. 2) Bill 2023-03-29.txt
1608099,Illegal Migration Bill: Committee of the whole House: Amendment 189,28/03/2023,https://hansard.parliament.uk/search/Divisions?startDate=2023-03-28&endDate=2023-03-28&searchTerm=Illegal Mi&house=Commons&includeCommitteeDivisions=False&partial=False&sortOrder=1,Illegal Migration Bill 2023-03-28.txt
1608100,Illegal Migration Bill: Committee of the whole House: Clause 11 stand part,28/03/2023,https://hansard.parliament.uk/search/Divisions?startDate=2023-03-28&endDate=2023-03-28&searchTerm=Illegal Mi&house=Commons&includeCommitteeDivisions=False&partial=False&sortOrder=1,Illegal Migration Bill 2023-03-28.txt
1608101,Illegal Migration Bill: Committee of the whole House: Amendment 288,28/03/2023,https://hansard.parliament.uk/search/Divisions?startDate=2023-03-28&endDate=2023-03-28&searchTerm=Illegal Mi&house=Commons&includeCommitteeDivisions=False&partial=False&sortOrder=1,Illegal Migration Bill 2023-03-28.txt
1608102,Illegal Migration Bill: Committee of the whole House: New Clause 21,28/03/2023,https://hansard.parliament.uk/search/Divisions?startDate=2023-03-28&endDate=2023-03-28&searchTerm=Illegal Mi&house=Commons&includeCommitteeDivisions=False&partial=False&sortOrder=1,Illegal Migration Bill 2023-03-28.txt
1608103,Illegal Migration Bill: Committee of the whole House: New Clause 27,28/03/2023,https://hansard.parliament.uk/search/Divisions?startDate=2023-03-28&endDate=2023-03-28&searchTerm=Illegal Mi&house=Commons&includeCommitteeDivisions=False&partial=False&sortOrder=1,Illegal Migration Bill 2023-03-28.txt
1607689,Illegal Migration Bill: Committee of the whole House: Amendment 76,27/03/2023,https://hansard.parliament.uk/search/Divisions?startDate=2023-03-27&endDate=2023-03-27&searchTerm=Illegal Mi&house=Commons&includeCommitteeDivisions=False&partial=False&sortOrder=1,Illegal Migration Bill 2023-03-27.txt
1607690,Illegal Migration Bill: Committee of the whole House: New Clause 6,27/03/2023,https://hansard.parliament.uk/search/Divisions?startDate=2023-03-27&endDate=2023-03-27&searchTerm=Illegal Mi&house=Commons&includeCommitteeDivisions=False&partial=False&sortOrder=1,Illegal Migration Bill 2023-03-27.txt
1607691,Illegal Migration Bill: Committee of the whole House: New Clause 24,27/03/2023,https://hansard.parliament.uk/search/Divisions?startDate=2023-03-27&endDate=2023-03-27&searchTerm=Illegal Mi&house=Commons&includeCommitteeDivisions=False&partial=False&sortOrder=1,Illegal Migration Bill 2023-03-27.txt
1607692,Illegal Migration Bill: Committee of the whole House: New Clause 25,27/03/2023,https://hansard.parliament.uk/search/Divisions?startDate=2023-03-27&endDate=2023-03-27&searchTerm=Illegal Mi&house=Commons&includeCommitteeDivisions=False&partial=False&sortOrder=1,Illegal Migration Bill 2023-03-27.txt
1606225,Draft Windsor Framework (Democratic Scrutiny) Regulations 2023,22/03/2023,https://hansard.parliament.uk/search/Divisions?startDate=2023-03-22&endDate=2023-03-22&searchTerm=Draft Wind&house=Commons&includeCommitteeDivisions=False&partial=False&sortOrder=1,
1606226,Draft Criminal Justice Act 2003 (Home Detention Curfew) Order 2023,22/03/2023,https://hansard.parliament.uk/search/Divisions?startDate=2023-03-22&endDate=2023-03-22&searchTerm=Draft Crim&house=Commons&includeCommitteeDivisions=False&partial=False&sortOrder=1,
1606228,Public Order Bill: Motion to disagree with the Lords in Amendments 6B to 6F,22/03/2023,https://hansard.parliament.uk/search/Divisions?startDate=2023-03-22&endDate=2023-03-22&searchTerm=Public Ord&house=Commons&includeCommitteeDivisions=False&partial=False&sortOrder=1,
1605837,Budget Motion no. 18: Pensions (lifetime allowance charge and annual allowance),21/03/2023,https://hansard.parliament.uk/search/Divisions?startDate=2023-03-21&endDate=2023-03-21&searchTerm=Budget Mot&house=Commons&includeCommitteeDivisions=False&partial=False&sortOrder=1,
1605839,Budget Motion no. 36: Alcohol duty,21/03/2023,https://hansard.parliament.uk/search/Divisions?startDate=2023-03-21&endDate=2023-03-21&searchTerm=Budget Mot&house=Commons&includeCommitteeDivisions=False&partial=False&sortOrder=1,
1603406,Illegal Migration Bill: Reasoned Amendment to Second Reading,13/03/2023,https://hansard.parliament.uk/search/Divisions?startDate=2023-03-13&endDate=2023-03-13&searchTerm=Illegal Mi&house=Commons&includeCommitteeDivisions=False&partial=False&sortOrder=1,Illegal Migration Bill 2023-03-13.txt
1603407,Illegal Migration Bill: Second Reading,13/03/2023,https://hansard.parliament.uk/search/Divisions?startDate=2023-03-13&endDate=2023-03-13&searchTerm=Illegal Mi&house=Commons&includeCommitteeDivisions=False&partial=False&sortOrder=1,Illegal Migration Bill 2023-03-13.txt
1603409,Illegal Migration Bill: Programme motion,13/03/2023,https://hansard.parliament.uk/search/Divisions?startDate=2023-03-13&endDate=2023-03-13&searchTerm=Illegal Mi&house=Commons&includeCommitteeDivisions=False&partial=False&sortOrder=1,Illegal Migration Bill 2023-03-13.txt
1603413,Illegal Migration Bill: Money,13/03/2023,https://hansard.parliament.uk/search/Divisions?startDate=2023-03-13&endDate=2023-03-13&searchTerm=Illegal Mi&house=Commons&includeCommitteeDivisions=False&partial=False&sortOrder=1,Illegal Migration Bill 2023-03-13.txt
1601775,Public Order Bill: Amendment (a) to Lords Amendment 5,07/03/2023,https://hansard.parliament.uk/search/Divisions?startDate=2023-03-07&endDate=2023-03-07&searchTerm=Public Ord&house=Commons&includeCommitteeDivisions=False&partial=False&sortOrder=1,Public Order Bill 2023-03-07.txt
1601780,Public Order Bill: Motion to disagree with Lords Amendment 6,07/03/2023,https://hansard.parliament.uk/search/Divisions?startDate=2023-03-07&endDate=2023-03-07&searchTerm=Public Ord&house=Commons&includeCommitteeDivisions=False&partial=False&sortOrder=1,Public Order Bill 2023-03-07.txt
1601782,Public Order Bill: Amendment (a) in lieu of Lords Amendment 1,07/03/2023,https://hansard.parliament.uk/search/Divisions?startDate=2023-03-07&endDate=2023-03-07&searchTerm=Public Ord&house=Commons&includeCommitteeDivisions=False&partial=False&sortOrder=1,Public Order Bill 2023-03-07.txt
1601783,Public Order Bill: Motion to disagree with Lords Amendment 1,07/03/2023,https://hansard.parliament.uk/search/Divisions?startDate=2023-03-07&endDate=2023-03-07&searchTerm=Public Ord&house=Commons&includeCommitteeDivisions=False&partial=False&sortOrder=1,Public Order Bill 2023-03-07.txt
1601784,Public Order Bill: Motion to disagree with Lords Amendment 20,07/03/2023,https://hansard.parliament.uk/search/Divisions?startDate=2023-03-07&endDate=2023-03-07&searchTerm=Public Ord&house=Commons&includeCommitteeDivisions=False&partial=False&sortOrder=1,Public Order Bill 2023-03-07.txt
1601273,Social Security (Additional Payments) (No. 2) Bill Committee: Amendment 4,06/03/2023,https://hansard.parliament.uk/search/Divisions?startDate=2023-03-06&endDate=2023-03-06&searchTerm=Social Sec&house=Commons&includeCommitteeDivisions=False&partial=False&sortOrder=1,Social Security (Additional Payments) (No. 2) Bill 2023-03-06.txt
1601274,Social Security (Additional Payments) (No. 2) Bill Committee: Amendment 2,06/03/2023,https://hansard.parliament.uk/search/Divisions?startDate=2023-03-06&endDate=2023-03-06&searchTerm=Social Sec&house=Commons&includeCommitteeDivisions=False&partial=False&sortOrder=1,Social Security (Additional Payments) (No. 2) Bill 2023-03-06.txt
1600213,Social Housing (Regulation) Bill [Lords] Report Stage: New Clause 7,01/03/2023,https://hansard.parliament.uk/search/Divisions?startDate=2023-03-01&endDate=2023-03-01&searchTerm=Social Hou&house=Commons&includeCommitteeDivisions=False&partial=False&sortOrder=1,Social Housing (Regulation)  Bill [Lords] 2023-03-01.txt
1600214,Social Housing (Regulation) Bill [Lords] Report Stage: Amendment 42,01/03/2023,https://hansard.parliament.uk/search/Divisions?startDate=2023-03-01&endDate=2023-03-01&searchTerm=Social Hou&house=Commons&includeCommitteeDivisions=False&partial=False&sortOrder=1,Social Housing (Regulation)  Bill [Lords] 2023-03-01.txt
1600217,Social Housing (Regulation) Bill [Lords] Report Stage: Amendment 40,01/03/2023,https://hansard.parliament.uk/search/Divisions?startDate=2023-03-01&endDate=2023-03-01&searchTerm=Social Hou&house=Commons&includeCommitteeDivisions=False&partial=False&sortOrder=1,Social Housing (Regulation)  Bill [Lords] 2023-03-01.txt
1599813,Opposition Day: Expanding the NHS workforce,28/02/2023,https://hansard.parliament.uk/search/Divisions?startDate=2023-02-28&endDate=2023-02-28&searchTerm=Opposition&house=Commons&includeCommitteeDivisions=False&partial=False&sortOrder=1,
1587638,Scottish Affairs Committee Membership,21/02/2023,https://hansard.parliament.uk/search/Divisions?startDate=2023-02-21&endDate=2023-02-21&searchTerm=Scottish A&house=Commons&includeCommitteeDivisions=False&partial=False&sortOrder=1,Scottish Affairs Committee 2023-02-21.txt
1584804,Seafarers' Wages Bill [Lords] Report Stage: New Clause 2,07/02/2023,https://hansard.parliament.uk/search/Divisions?startDate=2023-02-07&endDate=2023-02-07&searchTerm=Seafarers'&house=Commons&includeCommitteeDivisions=False&partial=False&sortOrder=1,
1584805,Seafarers' Wages Bill [Lords] Report Stage: New Clause 4,07/02/2023,https://hansard.parliament.uk/search/Divisions?startDate=2023-02-07&endDate=2023-02-07&searchTerm=Seafarers'&house=Commons&includeCommitteeDivisions=False&partial=False&sortOrder=1,
1584806,Seafarers' Wages Bill [Lords] Report Stage: Amendment 24,07/02/2023,https://hansard.parliament.uk/search/Divisions?startDate=2023-02-07&endDate=2023-02-07&searchTerm=Seafarers'&house=Commons&includeCommitteeDivisions=False&partial=False&sortOrder=1,
1584880,Nuclear Regulated Asset Base Model (Revenue Collection) Regulations 2023: Motion to approve,07/02/2023,https://hansard.parliament.uk/search/Divisions?startDate=2023-02-07&endDate=2023-02-07&searchTerm=Nuclear Re&house=Commons&includeCommitteeDivisions=False&partial=False&sortOrder=1,
1584881,Higher Education (Freedom of Speech) Bill: Motion to disagree with Lords Amendment 10,07/02/2023,https://hansard.parliament.uk/search/Divisions?startDate=2023-02-07&endDate=2023-02-07&searchTerm=Higher Edu&house=Commons&includeCommitteeDivisions=False&partial=False&sortOrder=1,Higher Education (Freedom of Speech) Bill 2023-02-07.txt
1582698,UK Infrastructure Bank Bill [Lords] Report Stage: New Clause 2,01/02/2023,https://hansard.parliament.uk/search/Divisions?startDate=2023-02-01&endDate=2023-02-01&searchTerm=UK Infrast&house=Commons&includeCommitteeDivisions=False&partial=False&sortOrder=1,UK Infrastructure Bank Bill [Lords] 2023-02-01.txt
1582699,UK Infrastructure Bank Bill [Lords] Report Stage: Amendment 5,01/02/2023,https://hansard.parliament.uk/search/Divisions?startDate=2023-02-01&endDate=2023-02-01&searchTerm=UK Infrast&house=Commons&includeCommitteeDivisions=False&partial=False&sortOrder=1,UK Infrastructure Bank Bill [Lords] 2023-02-01.txt
1582700,UK Infrastructure Bank Bill [Lords] Report Stage: Amendment 2,01/02/2023,https://hansard.parliament.uk/search/Divisions?startDate=2023-02-01&endDate=2023-02-01&searchTerm=UK Infrast&house=Commons&includeCommitteeDivisions=False&partial=False&sortOrder=1,UK Infrastructure Bank Bill [Lords] 2023-02-01.txt
1582170,Opposition Day: Crime and Neighbourhood Policing,31/01/2023,https://hansard.parliament.uk/search/Divisions?startDate=2023-01-31&endDate=2023-01-31&searchTerm=Opposition&house=Commons&includeCommitteeDivisions=False&partial=False&sortOrder=1,
1582172,Opposition Day: Crime and Neighbourhood Policing: Government amendment,31/01/2023,https://hansard.parliament.uk/search/Divisions?startDate=2023-01-31&endDate=2023-01-31&searchTerm=Opposition&house=Commons&includeCommitteeDivisions=False&partial=False&sortOrder=1,
1582180,Opposition Day: Non-domicile tax status,31/01/2023,https://hansard.parliament.uk/search/Divisions?startDate=2023-01-31&endDate=2023-01-31&searchTerm=Opposition&house=Commons&includeCommitteeDivisions=False&partial=False&sortOrder=1,
1581712,Strikes (Minimum Service Levels) Bill Committee: Amendment 32,30/01/2023,https://hansard.parliament.uk/search/Divisions?startDate=2023-01-30&endDate=2023-01-30&searchTerm=Strikes (M&house=Commons&includeCommitteeDivisions=False&partial=False&sortOrder=1,Strikes (Minimum Service Levels) Bill 2023-01-30.txt
1581713,Strikes (Minimum Service Levels) Bill Committee: Amendment 2,30/01/2023,https://hansard.parliament.uk/search/Divisions?startDate=2023-01-30&endDate=2023-01-30&searchTerm=Strikes (M&house=Commons&includeCommitteeDivisions=False&partial=False&sortOrder=1,Strikes (Minimum Service Levels) Bill 2023-01-30.txt
1581714,Strikes (Minimum Service Levels) Bill Committee: Amendment 4,30/01/2023,https://hansard.parliament.uk/search/Divisions?startDate=2023-01-30&endDate=2023-01-30&searchTerm=Strikes (M&house=Commons&includeCommitteeDivisions=False&partial=False&sortOrder=1,Strikes (Minimum Service Levels) Bill 2023-01-30.txt
1581715,Strikes (Minimum Service Levels) Bill Committee: Amendment 1,30/01/2023,https://hansard.parliament.uk/search/Divisions?startDate=2023-01-30&endDate=2023-01-30&searchTerm=Strikes (M&house=Commons&includeCommitteeDivisions=False&partial=False&sortOrder=1,Strikes (Minimum Service Levels) Bill 2023-01-30.txt
1581716,Strikes (Minimum Service Levels) Bill Committee: Third Reading,30/01/2023,https://hansard.parliament.uk/search/Divisions?startDate=2023-01-30&endDate=2023-01-30&searchTerm=Strikes (M&house=Commons&includeCommitteeDivisions=False&partial=False&sortOrder=1,Strikes (Minimum Service Levels) Bill 2023-01-30.txt
1580554,Draft Environmental Targets (Residual Waste) (England) Regulations 2022,25/01/2023,https://hansard.parliament.uk/search/Divisions?startDate=2023-01-25&endDate=2023-01-25&searchTerm=Draft Envi&house=Commons&includeCommitteeDivisions=False&partial=False&sortOrder=1,
1580555,Draft Environmental Targets (Biodiversity) (England) Regulations 2022,25/01/2023,https://hansard.parliament.uk/search/Divisions?startDate=2023-01-25&endDate=2023-01-25&searchTerm=Draft Envi&house=Commons&includeCommitteeDivisions=False&partial=False&sortOrder=1,
1580556,Draft Environmental Targets (Woodland and Trees Outside Woodland) (England) Regulations 2022,25/01/2023,https://hansard.parliament.uk/search/Divisions?startDate=2023-01-25&endDate=2023-01-25&searchTerm=Draft Envi&house=Commons&includeCommitteeDivisions=False&partial=False&sortOrder=1,
1580557,Draft Environmental Targets (Water) (England) Regulations 2022,25/01/2023,https://hansard.parliament.uk/search/Divisions?startDate=2023-01-25&endDate=2023-01-25&searchTerm=Draft Envi&house=Commons&includeCommitteeDivisions=False&partial=False&sortOrder=1,
1580558,Draft Environmental Targets (Fine Particulate Matter) (England) Regulations,25/01/2023,https://hansard.parliament.uk/search/Divisions?startDate=2023-01-25&endDate=2023-01-25&searchTerm=Draft Envi&house=Commons&includeCommitteeDivisions=False&partial=False&sortOrder=1,
1580563,Economic Crime and Corporate Transparency Bill Report Stage: New Clause 3,25/01/2023,https://hansard.parliament.uk/search/Divisions?startDate=2023-01-25&endDate=2023-01-25&searchTerm=Economic C&house=Commons&includeCommitteeDivisions=False&partial=False&sortOrder=1,Economic Crime and Corporate Transparency Bill 2023-01-25.txt
1580565,Economic Crime and Corporate Transparency Bill Report Stage: New Clause 26,25/01/2023,https://hansard.parliament.uk/search/Divisions?startDate=2023-01-25&endDate=2023-01-25&searchTerm=Economic C&house=Commons&includeCommitteeDivisions=False&partial=False&sortOrder=1,Economic Crime and Corporate Transparency Bill 2023-01-25.txt
1580566,Economic Crime and Corporate Transparency Bill Report Stage: New Clause 27,25/01/2023,https://hansard.parliament.uk/search/Divisions?startDate=2023-01-25&endDate=2023-01-25&searchTerm=Economic C&house=Commons&includeCommitteeDivisions=False&partial=False&sortOrder=1,Economic Crime and Corporate Transparency Bill 2023-01-25.txt
1580050,Economic Crime and Corporate Transparency Bill Report Stage: New Clause 22,24/01/2023,https://hansard.parliament.uk/search/Divisions?startDate=2023-01-24&endDate=2023-01-24&searchTerm=Economic C&house=Commons&includeCommitteeDivisions=False&partial=False&sortOrder=1,Economic Crime and Corporate Transparency Bill 2023-01-24.txt
1580051,Economic Crime and Corporate Transparency Bill Report Stage: New Clause 34,24/01/2023,https://hansard.parliament.uk/search/Divisions?startDate=2023-01-24&endDate=2023-01-24&searchTerm=Economic C&house=Commons&includeCommitteeDivisions=False&partial=False&sortOrder=1,Economic Crime and Corporate Transparency Bill 2023-01-24.txt
1580053,Economic Crime and Corporate Transparency Bill Report Stage: New Clause 36,24/01/2023,https://hansard.parliament.uk/search/Divisions?startDate=2023-01-24&endDate=2023-01-24&searchTerm=Economic C&house=Commons&includeCommitteeDivisions=False&partial=False&sortOrder=1,Economic Crime and Corporate Transparency Bill 2023-01-24.txt
1567930,Retained EU Law (Revocation and Reform) Bill Report Stage: Amendment 18,18/01/2023,https://hansard.parliament.uk/search/Divisions?startDate=2023-01-18&endDate=2023-01-18&searchTerm=Retained E&house=Commons&includeCommitteeDivisions=False&partial=False&sortOrder=1,Retained EU Law  (Revocation and Reform) Bill 2023-01-18.txt
1567935,Retained EU Law (Revocation and Reform) Bill Report Stage: Amendment 28,18/01/2023,https://hansard.parliament.uk/search/Divisions?startDate=2023-01-18&endDate=2023-01-18&searchTerm=Retained E&house=Commons&includeCommitteeDivisions=False&partial=False&sortOrder=1,Retained EU Law  (Revocation and Reform) Bill 2023-01-18.txt
1567937,Retained EU Law (Revocation and Reform) Bill Report Stage: Amendment 19,18/01/2023,https://hansard.parliament.uk/search/Divisions?startDate=2023-01-18&endDate=2023-01-18&searchTerm=Retained E&house=Commons&includeCommitteeDivisions=False&partial=False&sortOrder=1,Retained EU Law  (Revocation and Reform) Bill 2023-01-18.txt
1567938,Retained EU Law (Revocation and Reform) Bill Report Stage: Amendment 36,18/01/2023,https://hansard.parliament.uk/search/Divisions?startDate=2023-01-18&endDate=2023-01-18&searchTerm=Retained E&house=Commons&includeCommitteeDivisions=False&partial=False&sortOrder=1,Retained EU Law  (Revocation and Reform) Bill 2023-01-18.txt
1567939,Retained EU Law (Revocation and Reform) Bill: Third Reading,18/01/2023,https://hansard.parliament.uk/search/Divisions?startDate=2023-01-18&endDate=2023-01-18&searchTerm=Retained E&house=Commons&includeCommitteeDivisions=False&partial=False&sortOrder=1,Retained EU Law  (Revocation and Reform) Bill 2023-01-18.txt
1567457,Standing Order No. 24 debate: section 35 of the Scotland Act,17/01/2023,https://hansard.parliament.uk/search/Divisions?startDate=2023-01-17&endDate=2023-01-17&searchTerm=Standing O&house=Commons&includeCommitteeDivisions=False&partial=False&sortOrder=1,
1567461,Online Safety Bill Report Stage: New Clause 4,17/01/2023,https://hansard.parliament.uk/search/Divisions?startDate=2023-01-17&endDate=2023-01-17&searchTerm=Online Saf&house=Commons&includeCommitteeDivisions=False&partial=False&sortOrder=1,Online Safety Bill 2023-01-17.txt
1567462,Online Safety Bill Report Stage: Amendment 43,17/01/2023,https://hansard.parliament.uk/search/Divisions?startDate=2023-01-17&endDate=2023-01-17&searchTerm=Online Saf&house=Commons&includeCommitteeDivisions=False&partial=False&sortOrder=1,Online Safety Bill 2023-01-17.txt
1567044,Strikes (Minimum Service Levels) Bill: Second Reading,16/01/2023,https://hansard.parliament.uk/search/Divisions?startDate=2023-01-16&endDate=2023-01-16&searchTerm=Strikes (M&house=Commons&includeCommitteeDivisions=False&partial=False&sortOrder=1,Strikes (Minimum Service Levels) Bill 2023-01-16.txt
1567045,Strikes (Minimum Service Levels) Bill: Programme,16/01/2023,https://hansard.parliament.uk/search/Divisions?startDate=2023-01-16&endDate=2023-01-16&searchTerm=Strikes (M&house=Commons&includeCommitteeDivisions=False&partial=False&sortOrder=1,Strikes (Minimum Service Levels) Bill 2023-01-16.txt
1567046,Strikes (Minimum Service Levels) Bill: Money,16/01/2023,https://hansard.parliament.uk/search/Divisions?startDate=2023-01-16&endDate=2023-01-16&searchTerm=Strikes (M&house=Commons&includeCommitteeDivisions=False&partial=False&sortOrder=1,Strikes (Minimum Service Levels) Bill 2023-01-16.txt
1567047,Motion to sit in private,16/01/2023,https://hansard.parliament.uk/search/Divisions?startDate=2023-01-16&endDate=2023-01-16&searchTerm=Motion to &house=Commons&includeCommitteeDivisions=False&partial=False&sortOrder=1,
1565804,Opposition day: Fair Taxation of Schools and Education Standards Committee,11/01/2023,https://hansard.parliament.uk/search/Divisions?startDate=2023-01-11&endDate=2023-01-11&searchTerm=Opposition&house=Commons&includeCommitteeDivisions=False&partial=False&sortOrder=1,
1566134,Opposition day: NHS: Long-term strategy: Government amendment,11/01/2023,https://hansard.parliament.uk/search/Divisions?startDate=2023-01-11&endDate=2023-01-11&searchTerm=Opposition&house=Commons&includeCommitteeDivisions=False&partial=False&sortOrder=1,
1566135,Opposition day: NHS: Long-term strategy,11/01/2023,https://hansard.parliament.uk/search/Divisions?startDate=2023-01-11&endDate=2023-01-11&searchTerm=Opposition&house=Commons&includeCommitteeDivisions=False&partial=False&sortOrder=1,
1565360,Stamp Duty Land Tax (Reduction) Bill Committee: Amendment (a) to Government Amendment 1,10/01/2023,https://hansard.parliament.uk/search/Divisions?startDate=2023-01-10&endDate=2023-01-10&searchTerm=Stamp Duty&house=Commons&includeCommitteeDivisions=False&partial=False&sortOrder=1,Stamp Duty Land Tax  (Reduction) Bill 2023-01-10.txt
1565362,Stamp Duty Land Tax (Reduction) Bill Committee: New Clause 3,10/01/2023,https://hansard.parliament.uk/search/Divisions?startDate=2023-01-10&endDate=2023-01-10&searchTerm=Stamp Duty&house=Commons&includeCommitteeDivisions=False&partial=False&sortOrder=1,Stamp Duty Land Tax  (Reduction) Bill 2023-01-10.txt
1565363,Stamp Duty Land Tax (Temporary Relief) Bill: Third Reading,10/01/2023,https://hansard.parliament.uk/search/Divisions?startDate=2023-01-10&endDate=2023-01-10&searchTerm=Stamp Duty&house=Commons&includeCommitteeDivisions=False&partial=False&sortOrder=1,Stamp Duty Land Tax  (Reduction) Bill 2023-01-10.txt
1551479,Asylum Seekers (Removal to safe countries) - Leave to bring in bill,14/12/2022,https://hansard.parliament.uk/search/Divisions?startDate=2022-12-14&endDate=2022-12-14&searchTerm=Asylum See&house=Commons&includeCommitteeDivisions=False&partial=False&sortOrder=1,Asylum Seekers  (Removal to Safe Countries) 2022-12-14.txt
1551482,draft Architects Act 1997 (Amendment) Regulations 2022,14/12/2022,https://hansard.parliament.uk/search/Divisions?startDate=2022-12-14&endDate=2022-12-14&searchTerm=draft Arch&house=Commons&includeCommitteeDivisions=False&partial=False&sortOrder=1,
1551837,Opposition day: Scotland's future,14/12/2022,https://hansard.parliament.uk/search/Divisions?startDate=2022-12-14&endDate=2022-12-14&searchTerm=Opposition&house=Commons&includeCommitteeDivisions=False&partial=False&sortOrder=1,
1550925,Levelling-up and Regeneration Bill Report Stage: New Clause 98,13/12/2022,https://hansard.parliament.uk/search/Divisions?startDate=2022-12-13&endDate=2022-12-13&searchTerm=Levelling-&house=Commons&includeCommitteeDivisions=False&partial=False&sortOrder=1,Levelling-up and Regeneration Bill 2022-12-13.txt
1550926,Levelling-up and Regeneration Bill: New Clause 120,13/12/2022,https://hansard.parliament.uk/search/Divisions?startDate=2022-12-13&endDate=2022-12-13&searchTerm=Levelling-&house=Commons&includeCommitteeDivisions=False&partial=False&sortOrder=1,Levelling-up and Regeneration Bill 2022-12-13.txt
1550927,Levelling-up and Regeneration Bill Report Stage: Amendment 78,13/12/2022,https://hansard.parliament.uk/search/Divisions?startDate=2022-12-13&endDate=2022-12-13&searchTerm=Levelling-&house=Commons&includeCommitteeDivisions=False&partial=False&sortOrder=1,Levelling-up and Regeneration Bill 2022-12-13.txt
1550930,Levelling-up and Regeneration Bill: Amendment 84,13/12/2022,https://hansard.parliament.uk/search/Divisions?startDate=2022-12-13&endDate=2022-12-13&searchTerm=Levelling-&house=Commons&includeCommitteeDivisions=False&partial=False&sortOrder=1,Levelling-up and Regeneration Bill 2022-12-13.txt
1550420,Trade (Australia and New Zealand) Bill Report Stage: NC2,12/12/2022,https://hansard.parliament.uk/search/Divisions?startDate=2022-12-12&endDate=2022-12-12&searchTerm=Trade (Aus&house=Commons&includeCommitteeDivisions=False&partial=False&sortOrder=1,Trade (Australia and New Zealand) Bill 2022-12-12.txt
1550422,Trade (Australia and New Zealand) Bill Report Stage: NC12,12/12/2022,https://hansard.parliament.uk/search/Divisions?startDate=2022-12-12&endDate=2022-12-12&searchTerm=Trade (Aus&house=Commons&includeCommitteeDivisions=False&partial=False&sortOrder=1,Trade (Australia and New Zealand) Bill 2022-12-12.txt
1550423,Trade (Australia and New Zealand) Bill Report Stage: Amendment 3,12/12/2022,https://hansard.parliament.uk/search/Divisions?startDate=2022-12-12&endDate=2022-12-12&searchTerm=Trade (Aus&house=Commons&includeCommitteeDivisions=False&partial=False&sortOrder=1,Trade (Australia and New Zealand) Bill 2022-12-12.txt
1550426,Trade (Australia and New Zealand) Bill: Third Reading,12/12/2022,https://hansard.parliament.uk/search/Divisions?startDate=2022-12-12&endDate=2022-12-12&searchTerm=Trade (Aus&house=Commons&includeCommitteeDivisions=False&partial=False&sortOrder=1,Trade (Australia and New Zealand) Bill 2022-12-12.txt
1550431,Draft Voter Identification Regulations 2022,12/12/2022,https://hansard.parliament.uk/search/Divisions?startDate=2022-12-12&endDate=2022-12-12&searchTerm=Draft Vote&house=Commons&includeCommitteeDivisions=False&partial=False&sortOrder=1,
1550465, Standards Code of Conduct amendment (a),12/12/2022,https://hansard.parliament.uk/search/Divisions?startDate=2022-12-12&endDate=2022-12-12&searchTerm= Standards&house=Commons&includeCommitteeDivisions=False&partial=False&sortOrder=1,Standards_ Code of Conduct and Guide to the Rules 2022-12-12.txt
1550468,Standards Code of Conduct amendment (b),12/12/2022,https://hansard.parliament.uk/search/Divisions?startDate=2022-12-12&endDate=2022-12-12&searchTerm=Standards &house=Commons&includeCommitteeDivisions=False&partial=False&sortOrder=1,Standards_ Code of Conduct and Guide to the Rules 2022-12-12.txt
1549259,draft Police and Crime Commissioner Elections and Welsh Forms (Amendment) Order 2022,07/12/2022,https://hansard.parliament.uk/search/Divisions?startDate=2022-12-07&endDate=2022-12-07&searchTerm=draft Poli&house=Commons&includeCommitteeDivisions=False&partial=False&sortOrder=1,
1549260,draft Local Authorities (Mayoral Elections) (England and Wales) (Amendment) Regulations 2022,07/12/2022,https://hansard.parliament.uk/search/Divisions?startDate=2022-12-07&endDate=2022-12-07&searchTerm=draft Loca&house=Commons&includeCommitteeDivisions=False&partial=False&sortOrder=1,
1549261,draft Combined Authorities (Mayoral Elections) (Amendment) Order 2022,07/12/2022,https://hansard.parliament.uk/search/Divisions?startDate=2022-12-07&endDate=2022-12-07&searchTerm=draft Comb&house=Commons&includeCommitteeDivisions=False&partial=False&sortOrder=1,
1549262,draft Agricultural Holdings (Fee) Regulations 2022,07/12/2022,https://hansard.parliament.uk/search/Divisions?startDate=2022-12-07&endDate=2022-12-07&searchTerm=draft Agri&house=Commons&includeCommitteeDivisions=False&partial=False&sortOrder=1,
1549268,Financial Services and Markets Bill Report Stage: New Clause 1,07/12/2022,https://hansard.parliament.uk/search/Divisions?startDate=2022-12-07&endDate=2022-12-07&searchTerm=Financial &house=Commons&includeCommitteeDivisions=False&partial=False&sortOrder=1,Financial Services and Markets Bill 2022-12-07.txt
1549269,Financial Markets and Services Bill Report Stage: New Clause 2,07/12/2022,https://hansard.parliament.uk/search/Divisions?startDate=2022-12-07&endDate=2022-12-07&searchTerm=Financial &house=Commons&includeCommitteeDivisions=False&partial=False&sortOrder=1,Financial Services and Markets Bill 2022-12-07.txt
1549270,Financial Markets and Services Bill Report Stage: New Clause 7,07/12/2022,https://hansard.parliament.uk/search/Divisions?startDate=2022-12-07&endDate=2022-12-07&searchTerm=Financial &house=Commons&includeCommitteeDivisions=False&partial=False&sortOrder=1,Financial Services and Markets Bill 2022-12-07.txt
1548747,Opposition Day: NHS Workforce,06/12/2022,https://hansard.parliament.uk/search/Divisions?startDate=2022-12-06&endDate=2022-12-06&searchTerm=Opposition&house=Commons&includeCommitteeDivisions=False&partial=False&sortOrder=1,
1548317,Online Safety Bill Report Stage: New Clause 16,05/12/2022,https://hansard.parliament.uk/search/Divisions?startDate=2022-12-05&endDate=2022-12-05&searchTerm=Online Saf&house=Commons&includeCommitteeDivisions=False&partial=False&sortOrder=1,Online Safety Bill 2022-12-05.txt
1548318,Online Safety Bill Report Stage: New Clause 17,05/12/2022,https://hansard.parliament.uk/search/Divisions?startDate=2022-12-05&endDate=2022-12-05&searchTerm=Online Saf&house=Commons&includeCommitteeDivisions=False&partial=False&sortOrder=1,Online Safety Bill 2022-12-05.txt
1548319,Online Safety Bill Report Stage: New Clause 28,05/12/2022,https://hansard.parliament.uk/search/Divisions?startDate=2022-12-05&endDate=2022-12-05&searchTerm=Online Saf&house=Commons&includeCommitteeDivisions=False&partial=False&sortOrder=1,Online Safety Bill 2022-12-05.txt
1548321,Online Safety Bill: Programme (No. 4) Motion ,05/12/2022,https://hansard.parliament.uk/search/Divisions?startDate=2022-12-05&endDate=2022-12-05&searchTerm=Online Saf&house=Commons&includeCommitteeDivisions=False&partial=False&sortOrder=1,Online Safety Bill  (Programme) (No. 4) 2022-12-05.txt
1546742,Finance Bill Committee: Amendment 2,30/11/2022,https://hansard.parliament.uk/search/Divisions?startDate=2022-11-30&endDate=2022-11-30&searchTerm=Finance Bi&house=Commons&includeCommitteeDivisions=False&partial=False&sortOrder=1,Finance Bill 2022-11-30.txt
1546746,Finance Bill Committee: New Clause 2,30/11/2022,https://hansard.parliament.uk/search/Divisions?startDate=2022-11-30&endDate=2022-11-30&searchTerm=Finance Bi&house=Commons&includeCommitteeDivisions=False&partial=False&sortOrder=1,Finance Bill 2022-11-30.txt
1546747,Finance Bill Committee: New Clause 3,30/11/2022,https://hansard.parliament.uk/search/Divisions?startDate=2022-11-30&endDate=2022-11-30&searchTerm=Finance Bi&house=Commons&includeCommitteeDivisions=False&partial=False&sortOrder=1,Finance Bill 2022-11-30.txt
1546748,Finance Bill Committee: Third Reading,30/11/2022,https://hansard.parliament.uk/search/Divisions?startDate=2022-11-30&endDate=2022-11-30&searchTerm=Finance Bi&house=Commons&includeCommitteeDivisions=False&partial=False&sortOrder=1,Finance Bill 2022-11-30.txt
1546752,Finance Bill Committee: Clause 5 stand part,30/11/2022,https://hansard.parliament.uk/search/Divisions?startDate=2022-11-30&endDate=2022-11-30&searchTerm=Finance Bi&house=Commons&includeCommitteeDivisions=False&partial=False&sortOrder=1,Finance Bill 2022-11-30.txt
1546317,Privilege Motion,29/11/2022,https://hansard.parliament.uk/search/Divisions?startDate=2022-11-29&endDate=2022-11-29&searchTerm=Privilege &house=Commons&includeCommitteeDivisions=False&partial=False&sortOrder=1,Privilege 2022-11-29.txt
1545779,Finance Bill: Reasoned Amendment to Second Reading,28/11/2022,https://hansard.parliament.uk/search/Divisions?startDate=2022-11-28&endDate=2022-11-28&searchTerm=Finance Bi&house=Commons&includeCommitteeDivisions=False&partial=False&sortOrder=1,Finance Bill 2022-11-28.txt
1545823,Finance Bill: Second Reading,28/11/2022,https://hansard.parliament.uk/search/Divisions?startDate=2022-11-28&endDate=2022-11-28&searchTerm=Finance Bi&house=Commons&includeCommitteeDivisions=False&partial=False&sortOrder=1,Finance Bill 2022-11-28.txt
1544798,Levelling-up and Regeneration Bill Report Stage: New Clause 41 ,23/11/2022,https://hansard.parliament.uk/search/Divisions?startDate=2022-11-23&endDate=2022-11-23&searchTerm=Levelling-&house=Commons&includeCommitteeDivisions=False&partial=False&sortOrder=1,Levelling-up and Regeneration Bill 2022-11-23.txt
1544799,Levelling-up and Regeneration Bill Report Stage: New Clause 46,23/11/2022,https://hansard.parliament.uk/search/Divisions?startDate=2022-11-23&endDate=2022-11-23&searchTerm=Levelling-&house=Commons&includeCommitteeDivisions=False&partial=False&sortOrder=1,Levelling-up and Regeneration Bill 2022-11-23.txt
1544800,Levelling-up and Regeneration Bill Report Stage: New Clause 84,23/11/2022,https://hansard.parliament.uk/search/Divisions?startDate=2022-11-23&endDate=2022-11-23&searchTerm=Levelling-&house=Commons&includeCommitteeDivisions=False&partial=False&sortOrder=1,Levelling-up and Regeneration Bill 2022-11-23.txt
1544801,Levelling-up and Regeneration Bill Report Stage: Amendment 14,23/11/2022,https://hansard.parliament.uk/search/Divisions?startDate=2022-11-23&endDate=2022-11-23&searchTerm=Levelling-&house=Commons&includeCommitteeDivisions=False&partial=False&sortOrder=1,Levelling-up and Regeneration Bill 2022-11-23.txt
1544345,Ways and Means Motion No. 3: Basic rate limit and personal allowance for tax years 2026-27 and 2027-28,22/11/2022,https://hansard.parliament.uk/search/Divisions?startDate=2022-11-22&endDate=2022-11-22&searchTerm=Ways and M&house=Commons&includeCommitteeDivisions=False&partial=False&sortOrder=1,
1543529,Motion to sit in private,18/11/2022,https://hansard.parliament.uk/search/Divisions?startDate=2022-11-18&endDate=2022-11-18&searchTerm=Motion to &house=Commons&includeCommitteeDivisions=False&partial=False&sortOrder=1,
1542755,National Security Bill Report Stage: New Clause 3,16/11/2022,https://hansard.parliament.uk/search/Divisions?startDate=2022-11-16&endDate=2022-11-16&searchTerm=National S&house=Commons&includeCommitteeDivisions=False&partial=False&sortOrder=1,National Security Bill 2022-11-16.txt
1542756,National Security Bill Report Stage: Amendment 14,16/11/2022,https://hansard.parliament.uk/search/Divisions?startDate=2022-11-16&endDate=2022-11-16&searchTerm=National S&house=Commons&includeCommitteeDivisions=False&partial=False&sortOrder=1,National Security Bill 2022-11-16.txt
1542757,National Security Bill Report Stage: Amendment 132,16/11/2022,https://hansard.parliament.uk/search/Divisions?startDate=2022-11-16&endDate=2022-11-16&searchTerm=National S&house=Commons&includeCommitteeDivisions=False&partial=False&sortOrder=1,National Security Bill 2022-11-16.txt
1542758,National Security Bill Report Stage: Government Amendment 60,16/11/2022,https://hansard.parliament.uk/search/Divisions?startDate=2022-11-16&endDate=2022-11-16&searchTerm=National S&house=Commons&includeCommitteeDivisions=False&partial=False&sortOrder=1,National Security Bill 2022-11-16.txt
1540507,Opposition Day: the State Pension triple lock,08/11/2022,https://hansard.parliament.uk/search/Divisions?startDate=2022-11-08&endDate=2022-11-08&searchTerm=Opposition&house=Commons&includeCommitteeDivisions=False&partial=False&sortOrder=1,
1540513,Opposition Day: Papers relating to the Home Secretary,08/11/2022,https://hansard.parliament.uk/search/Divisions?startDate=2022-11-08&endDate=2022-11-08&searchTerm=Opposition&house=Commons&includeCommitteeDivisions=False&partial=False&sortOrder=1,
1538504,Opposition Day: Scottish Independence and Scottish Economy,02/11/2022,https://hansard.parliament.uk/search/Divisions?startDate=2022-11-02&endDate=2022-11-02&searchTerm=Opposition&house=Commons&includeCommitteeDivisions=False&partial=False&sortOrder=1,
1537269,Genetic Technology (Precision Breeding) Bill Report Stage: New Clause 9,31/10/2022,https://hansard.parliament.uk/search/Divisions?startDate=2022-10-31&endDate=2022-10-31&searchTerm=Genetic Te&house=Commons&includeCommitteeDivisions=False&partial=False&sortOrder=1,Genetic Technology (Precision Breeding) Bill 2022-10-31.txt
1537270,Genetic Technology (Precision Breeding) Bill Report Stage: Amendment 1,31/10/2022,https://hansard.parliament.uk/search/Divisions?startDate=2022-10-31&endDate=2022-10-31&searchTerm=Genetic Te&house=Commons&includeCommitteeDivisions=False&partial=False&sortOrder=1,Genetic Technology (Precision Breeding) Bill 2022-10-31.txt
1537271,Genetic Technology (Precision Breeding) Bill Report Stage: Amendment 3,31/10/2022,https://hansard.parliament.uk/search/Divisions?startDate=2022-10-31&endDate=2022-10-31&searchTerm=Genetic Te&house=Commons&includeCommitteeDivisions=False&partial=False&sortOrder=1,Genetic Technology (Precision Breeding) Bill 2022-10-31.txt
1537272,Genetic Technology (Precision Breeding) Bill Report Stage: Amendment 4,31/10/2022,https://hansard.parliament.uk/search/Divisions?startDate=2022-10-31&endDate=2022-10-31&searchTerm=Genetic Te&house=Commons&includeCommitteeDivisions=False&partial=False&sortOrder=1,Genetic Technology (Precision Breeding) Bill 2022-10-31.txt
1537273,Product Security and Telecommunications Infrastructure Bill: motion to disagree with Lords Amendment 17,31/10/2022,https://hansard.parliament.uk/search/Divisions?startDate=2022-10-31&endDate=2022-10-31&searchTerm=Product Se&house=Commons&includeCommitteeDivisions=False&partial=False&sortOrder=1,Product Security and Telecommunications Infrastructure Bill 2022-10-31.txt
1537066,Motion to sit in private,28/10/2022,https://hansard.parliament.uk/search/Divisions?startDate=2022-10-28&endDate=2022-10-28&searchTerm=Motion to &house=Commons&includeCommitteeDivisions=False&partial=False&sortOrder=1,
1536230,Identity and Language (Northern Ireland) Bill [Lords] Committee: Amendment 6,26/10/2022,https://hansard.parliament.uk/search/Divisions?startDate=2022-10-26&endDate=2022-10-26&searchTerm=Identity a&house=Commons&includeCommitteeDivisions=False&partial=False&sortOrder=1,Identity and Language  (Northern Ireland) Bill [Lords] 2022-10-26.txt
1536231,Identity and Language (Northern Ireland) Bill [Lords] Committee: Amendment 1 ,26/10/2022,https://hansard.parliament.uk/search/Divisions?startDate=2022-10-26&endDate=2022-10-26&searchTerm=Identity a&house=Commons&includeCommitteeDivisions=False&partial=False&sortOrder=1,Identity and Language  (Northern Ireland) Bill [Lords] 2022-10-26.txt
1536232,Identity and Language (Northern Ireland) Bill [Lords] Committee: Amendment 13,26/10/2022,https://hansard.parliament.uk/search/Divisions?startDate=2022-10-26&endDate=2022-10-26&searchTerm=Identity a&house=Commons&includeCommitteeDivisions=False&partial=False&sortOrder=1,Identity and Language  (Northern Ireland) Bill [Lords] 2022-10-26.txt
1535659,Motion to sit in private,25/10/2022,https://hansard.parliament.uk/search/Divisions?startDate=2022-10-25&endDate=2022-10-25&searchTerm=Motion to &house=Commons&includeCommitteeDivisions=False&partial=False&sortOrder=1,
1535662,Retained EU Law (Revocation and Reform) Bill: Reasoned Amendment to Second Reading,25/10/2022,https://hansard.parliament.uk/search/Divisions?startDate=2022-10-25&endDate=2022-10-25&searchTerm=Retained E&house=Commons&includeCommitteeDivisions=False&partial=False&sortOrder=1,Retained EU Law  (Revocation and Reform) Bill 2022-10-25.txt
1535669,Retained EU Law (Revocation and Reform) Bill: Second Reading,25/10/2022,https://hansard.parliament.uk/search/Divisions?startDate=2022-10-25&endDate=2022-10-25&searchTerm=Retained E&house=Commons&includeCommitteeDivisions=False&partial=False&sortOrder=1,Retained EU Law  (Revocation and Reform) Bill 2022-10-25.txt
1535670,Retained EU Law (Revocation and Reform) Bill: Programme Motion,25/10/2022,https://hansard.parliament.uk/search/Divisions?startDate=2022-10-25&endDate=2022-10-25&searchTerm=Retained E&house=Commons&includeCommitteeDivisions=False&partial=False&sortOrder=1,Retained EU Law  (Revocation and Reform) Bill 2022-10-25.txt
1535674,Retained EU Law (Revocation and Reform) Bill: Money,25/10/2022,https://hansard.parliament.uk/search/Divisions?startDate=2022-10-25&endDate=2022-10-25&searchTerm=Retained E&house=Commons&includeCommitteeDivisions=False&partial=False&sortOrder=1,Retained EU Law  (Revocation and Reform) Bill 2022-10-25.txt
1535675,Retained EU Law (Revocation and Reform) Bill: Ways and Means,25/10/2022,https://hansard.parliament.uk/search/Divisions?startDate=2022-10-25&endDate=2022-10-25&searchTerm=Retained E&house=Commons&includeCommitteeDivisions=False&partial=False&sortOrder=1,Retained EU Law  (Revocation and Reform) Bill 2022-10-25.txt
1535081,Stamp Duty Land Tax (Reduction) Amendment (a),24/10/2022,https://hansard.parliament.uk/search/Divisions?startDate=2022-10-24&endDate=2022-10-24&searchTerm=Stamp Duty&house=Commons&includeCommitteeDivisions=False&partial=False&sortOrder=1,Stamp Duty Land Tax (Reduction) 2022-10-24.txt
1535084,Stamp Duty Land Tax (main motion),24/10/2022,https://hansard.parliament.uk/search/Divisions?startDate=2022-10-24&endDate=2022-10-24&searchTerm=Stamp Duty&house=Commons&includeCommitteeDivisions=False&partial=False&sortOrder=1,Stamp Duty Land Tax (Reduction) 2022-10-24.txt
1535086,Stamp Duty Land Tax (Reduction) Bill: second reading,24/10/2022,https://hansard.parliament.uk/search/Divisions?startDate=2022-10-24&endDate=2022-10-24&searchTerm=Stamp Duty&house=Commons&includeCommitteeDivisions=False&partial=False&sortOrder=1,Stamp Duty Land Tax (Reduction) 2022-10-24.txt
1524958,Motion to sit in private,21/10/2022,https://hansard.parliament.uk/search/Divisions?startDate=2022-10-21&endDate=2022-10-21&searchTerm=Motion to &house=Commons&includeCommitteeDivisions=False&partial=False&sortOrder=1,
1523986,Opposition Day: Economic responsibility and a plan for growth,19/10/2022,https://hansard.parliament.uk/search/Divisions?startDate=2022-10-19&endDate=2022-10-19&searchTerm=Opposition&house=Commons&includeCommitteeDivisions=False&partial=False&sortOrder=1,
1524003,Ban on Fracking for Shale Gas Bill,19/10/2022,https://hansard.parliament.uk/search/Divisions?startDate=2022-10-19&endDate=2022-10-19&searchTerm=Ban on Fra&house=Commons&includeCommitteeDivisions=False&partial=False&sortOrder=1,Ban on Fracking for Shale Gas Bill 2022-10-19.txt
1523316,Public Order Bill Report Stage: New Clause 4,18/10/2022,https://hansard.parliament.uk/search/Divisions?startDate=2022-10-18&endDate=2022-10-18&searchTerm=Public Ord&house=Commons&includeCommitteeDivisions=False&partial=False&sortOrder=1,Public Order Bill 2022-10-18.txt
1523317,Public Order Bill Report Stage: Amendment 1,18/10/2022,https://hansard.parliament.uk/search/Divisions?startDate=2022-10-18&endDate=2022-10-18&searchTerm=Public Ord&house=Commons&includeCommitteeDivisions=False&partial=False&sortOrder=1,Public Order Bill 2022-10-18.txt
1523318,Public Order Bill Report Stage: New Clause 11,18/10/2022,https://hansard.parliament.uk/search/Divisions?startDate=2022-10-18&endDate=2022-10-18&searchTerm=Public Ord&house=Commons&includeCommitteeDivisions=False&partial=False&sortOrder=1,Public Order Bill 2022-10-18.txt
1523319,Public Order Bill Report Stage: New Clause 5,18/10/2022,https://hansard.parliament.uk/search/Divisions?startDate=2022-10-18&endDate=2022-10-18&searchTerm=Public Ord&house=Commons&includeCommitteeDivisions=False&partial=False&sortOrder=1,Public Order Bill 2022-10-18.txt
1523320,Public Order Bill: Third Reading,18/10/2022,https://hansard.parliament.uk/search/Divisions?startDate=2022-10-18&endDate=2022-10-18&searchTerm=Public Ord&house=Commons&includeCommitteeDivisions=False&partial=False&sortOrder=1,Public Order Bill 2022-10-18.txt
1522719,Energy Prices Bill Committee: New Clause 3,17/10/2022,https://hansard.parliament.uk/search/Divisions?startDate=2022-10-17&endDate=2022-10-17&searchTerm=Energy Pri&house=Commons&includeCommitteeDivisions=False&partial=False&sortOrder=1,Energy Prices Bill 2022-10-17.txt
1522720,Energy Prices Bill Committee: New Clause 18,17/10/2022,https://hansard.parliament.uk/search/Divisions?startDate=2022-10-17&endDate=2022-10-17&searchTerm=Energy Pri&house=Commons&includeCommitteeDivisions=False&partial=False&sortOrder=1,Energy Prices Bill 2022-10-17.txt
1522721,Energy Prices Bill Committee: Amendment 2,17/10/2022,https://hansard.parliament.uk/search/Divisions?startDate=2022-10-17&endDate=2022-10-17&searchTerm=Energy Pri&house=Commons&includeCommitteeDivisions=False&partial=False&sortOrder=1,Energy Prices Bill 2022-10-17.txt
1520976,Identity and Language (Northern Ireland) Bill [Lords]: Second Reading,12/10/2022,https://hansard.parliament.uk/search/Divisions?startDate=2022-10-12&endDate=2022-10-12&searchTerm=Identity a&house=Commons&includeCommitteeDivisions=False&partial=False&sortOrder=1,Identity and Language  (Northern Ireland) Bill [Lords] 2022-10-12.txt
1520309,Health and Social Care Levy (Repeal) Bill: New Clause 1,11/10/2022,https://hansard.parliament.uk/search/Divisions?startDate=2022-10-11&endDate=2022-10-11&searchTerm=Health and&house=Commons&includeCommitteeDivisions=False&partial=False&sortOrder=1,Health and Social Care Levy (Repeal) Bill 2022-10-11.txt
1505267,Trade (Australia and New Zealand) Bill: Second Reading,06/09/2022,https://hansard.parliament.uk/search/Divisions?startDate=2022-09-06&endDate=2022-09-06&searchTerm=Trade (Aus&house=Commons&includeCommitteeDivisions=False&partial=False&sortOrder=1,Trade (Australia and  New Zealand) Bill 2022-09-06.txt
1490946,Northern Ireland Protocol Bill Committee: Amendment 12,20/07/2022,https://hansard.parliament.uk/search/Divisions?startDate=2022-07-20&endDate=2022-07-20&searchTerm=Northern I&house=Commons&includeCommitteeDivisions=False&partial=False&sortOrder=1,Northern Ireland Protocol Bill 2022-07-20.txt
1490947,Northern Ireland Protocol Bill Committee: Amendment 49,20/07/2022,https://hansard.parliament.uk/search/Divisions?startDate=2022-07-20&endDate=2022-07-20&searchTerm=Northern I&house=Commons&includeCommitteeDivisions=False&partial=False&sortOrder=1,Northern Ireland Protocol Bill 2022-07-20.txt
1490949,Northern Ireland Protocol Bill Committee: Amendment 3 ,20/07/2022,https://hansard.parliament.uk/search/Divisions?startDate=2022-07-20&endDate=2022-07-20&searchTerm=Northern I&house=Commons&includeCommitteeDivisions=False&partial=False&sortOrder=1,Northern Ireland Protocol Bill 2022-07-20.txt
1490950,Northern Ireland Protocol Bill Committee: New Clause 12,20/07/2022,https://hansard.parliament.uk/search/Divisions?startDate=2022-07-20&endDate=2022-07-20&searchTerm=Northern I&house=Commons&includeCommitteeDivisions=False&partial=False&sortOrder=1,Northern Ireland Protocol Bill 2022-07-20.txt
1490952,Northern Ireland Protocol Bill: Third Reading,20/07/2022,https://hansard.parliament.uk/search/Divisions?startDate=2022-07-20&endDate=2022-07-20&searchTerm=Northern I&house=Commons&includeCommitteeDivisions=False&partial=False&sortOrder=1,Northern Ireland Protocol Bill 2022-07-20.txt
1490488,Northern Ireland Protocol Bill Committee: Amendment 44,19/07/2022,https://hansard.parliament.uk/search/Divisions?startDate=2022-07-19&endDate=2022-07-19&searchTerm=Northern I&house=Commons&includeCommitteeDivisions=False&partial=False&sortOrder=1,Northern Ireland Protocol Bill 2022-07-19.txt
1490493,Northern Ireland Protocol Bill Committee: Amendment 28,19/07/2022,https://hansard.parliament.uk/search/Divisions?startDate=2022-07-19&endDate=2022-07-19&searchTerm=Northern I&house=Commons&includeCommitteeDivisions=False&partial=False&sortOrder=1,Northern Ireland Protocol Bill 2022-07-19.txt
1490497,Northern Ireland Protocol Bill Committee: New Clause 15,19/07/2022,https://hansard.parliament.uk/search/Divisions?startDate=2022-07-19&endDate=2022-07-19&searchTerm=Northern I&house=Commons&includeCommitteeDivisions=False&partial=False&sortOrder=1,Northern Ireland Protocol Bill 2022-07-19.txt
1489934,Confidence in Her Majestys Government,18/07/2022,https://hansard.parliament.uk/search/Divisions?startDate=2022-07-18&endDate=2022-07-18&searchTerm=Confidence&house=Commons&includeCommitteeDivisions=False&partial=False&sortOrder=1,Confidence in Her Majestys Government 2022-07-18.txt
1488664,Northern Ireland Protocol Bill Committee: Amendment 26,13/07/2022,https://hansard.parliament.uk/search/Divisions?startDate=2022-07-13&endDate=2022-07-13&searchTerm=Northern I&house=Commons&includeCommitteeDivisions=False&partial=False&sortOrder=1,Northern Ireland Protocol Bill 2022-07-13.txt
1488667,Northern Ireland Protocol Bill Committee: Amendment 8,13/07/2022,https://hansard.parliament.uk/search/Divisions?startDate=2022-07-13&endDate=2022-07-13&searchTerm=Northern I&house=Commons&includeCommitteeDivisions=False&partial=False&sortOrder=1,Northern Ireland Protocol Bill 2022-07-13.txt
1488669,Northern Ireland Protocol Bill: Clauses 15 and 16 stand part,13/07/2022,https://hansard.parliament.uk/search/Divisions?startDate=2022-07-13&endDate=2022-07-13&searchTerm=Northern I&house=Commons&includeCommitteeDivisions=False&partial=False&sortOrder=1,Northern Ireland Protocol Bill 2022-07-13.txt
1488670,Northern Ireland Protocol Bill: New Clause 10,13/07/2022,https://hansard.parliament.uk/search/Divisions?startDate=2022-07-13&endDate=2022-07-13&searchTerm=Northern I&house=Commons&includeCommitteeDivisions=False&partial=False&sortOrder=1,Northern Ireland Protocol Bill 2022-07-13.txt
1488673,Northern Ireland Protocol Bill: Amendment 24,13/07/2022,https://hansard.parliament.uk/search/Divisions?startDate=2022-07-13&endDate=2022-07-13&searchTerm=Northern I&house=Commons&includeCommitteeDivisions=False&partial=False&sortOrder=1,Northern Ireland Protocol Bill 2022-07-13.txt
1488172,Online Safety Bill Report Stage: New Clause 3,12/07/2022,https://hansard.parliament.uk/search/Divisions?startDate=2022-07-12&endDate=2022-07-12&searchTerm=Online Saf&house=Commons&includeCommitteeDivisions=False&partial=False&sortOrder=1,Online Safety Bill 2022-07-12.txt
1488175,Online Safety Bill Report Stage: Amendment 187,12/07/2022,https://hansard.parliament.uk/search/Divisions?startDate=2022-07-12&endDate=2022-07-12&searchTerm=Online Saf&house=Commons&includeCommitteeDivisions=False&partial=False&sortOrder=1,Online Safety Bill 2022-07-12.txt
1488178,Online Safety Bill Report Stage: New Clause 14,12/07/2022,https://hansard.parliament.uk/search/Divisions?startDate=2022-07-12&endDate=2022-07-12&searchTerm=Online Saf&house=Commons&includeCommitteeDivisions=False&partial=False&sortOrder=1,Online Safety Bill 2022-07-12.txt
1488181,Online Safety Bill Report Stage: New Clause 7,12/07/2022,https://hansard.parliament.uk/search/Divisions?startDate=2022-07-12&endDate=2022-07-12&searchTerm=Online Saf&house=Commons&includeCommitteeDivisions=False&partial=False&sortOrder=1,Online Safety Bill 2022-07-12.txt
1488182,Online Safety Bill Report Stage: Amendment 31,12/07/2022,https://hansard.parliament.uk/search/Divisions?startDate=2022-07-12&endDate=2022-07-12&searchTerm=Online Saf&house=Commons&includeCommitteeDivisions=False&partial=False&sortOrder=1,Online Safety Bill 2022-07-12.txt
1487750,Energy (Oil and Gas) Profits Levy Bill Committee: Amendment 9,11/07/2022,https://hansard.parliament.uk/search/Divisions?startDate=2022-07-11&endDate=2022-07-11&searchTerm=Energy (Oi&house=Commons&includeCommitteeDivisions=False&partial=False&sortOrder=1,Energy (Oil and Gas) Profits Levy Bill 2022-07-11.txt
1487751,Energy (Oil and Gas) Energy Profits Levy Bill Committee: Clause 2 stand part,11/07/2022,https://hansard.parliament.uk/search/Divisions?startDate=2022-07-11&endDate=2022-07-11&searchTerm=Energy (Oi&house=Commons&includeCommitteeDivisions=False&partial=False&sortOrder=1,Energy (Oil and Gas) Profits Levy Bill 2022-07-11.txt
1487752,Energy (Oil and Gas) Profits Levy Bill Committee: New Clause 3,11/07/2022,https://hansard.parliament.uk/search/Divisions?startDate=2022-07-11&endDate=2022-07-11&searchTerm=Energy (Oi&house=Commons&includeCommitteeDivisions=False&partial=False&sortOrder=1,Energy (Oil and Gas) Profits Levy Bill 2022-07-11.txt
1487804,draft Conduct of Employment Agencies and Employment Businesses (Amendment) Regulations 2022,11/07/2022,https://hansard.parliament.uk/search/Divisions?startDate=2022-07-11&endDate=2022-07-11&searchTerm=draft Cond&house=Commons&includeCommitteeDivisions=False&partial=False&sortOrder=1,
1487805,Humble Address: Liability of Trade Unions in Proceedings in Tort (Increase of Limits on Damages) Order 2022,11/07/2022,https://hansard.parliament.uk/search/Divisions?startDate=2022-07-11&endDate=2022-07-11&searchTerm=Humble Add&house=Commons&includeCommitteeDivisions=False&partial=False&sortOrder=1,
1485880,Northern Ireland Troubles (Legacy and Reconciliation) Bill Committee: Amendment 114,04/07/2022,https://hansard.parliament.uk/search/Divisions?startDate=2022-07-04&endDate=2022-07-04&searchTerm=Northern I&house=Commons&includeCommitteeDivisions=False&partial=False&sortOrder=1,Northern Ireland Troubles  (Legacy and Reconciliation) Bill 2022-07-04.txt
1485881,Northern Ireland Troubles (Legacy and Reconciliation) Bill Committee: Amendment 116,04/07/2022,https://hansard.parliament.uk/search/Divisions?startDate=2022-07-04&endDate=2022-07-04&searchTerm=Northern I&house=Commons&includeCommitteeDivisions=False&partial=False&sortOrder=1,Northern Ireland Troubles  (Legacy and Reconciliation) Bill 2022-07-04.txt
1485882,Northern Ireland Troubles (Legacy and Reconciliation) Bill Committee: Clause 39 stand part,04/07/2022,https://hansard.parliament.uk/search/Divisions?startDate=2022-07-04&endDate=2022-07-04&searchTerm=Northern I&house=Commons&includeCommitteeDivisions=False&partial=False&sortOrder=1,Northern Ireland Troubles  (Legacy and Reconciliation) Bill 2022-07-04.txt
1485883,Northern Ireland Troubles (Legacy & Reconciliation) Bill Committee: New Clause 5,04/07/2022,https://hansard.parliament.uk/search/Divisions?startDate=2022-07-04&endDate=2022-07-04&searchTerm=Northern I&house=Commons&includeCommitteeDivisions=False&partial=False&sortOrder=1,Northern Ireland Troubles  (Legacy and Reconciliation) Bill 2022-07-04.txt
1485887,Northern Ireland Troubles (Legacy and Reconciliation) Bill Committee: New Clause 4,04/07/2022,https://hansard.parliament.uk/search/Divisions?startDate=2022-07-04&endDate=2022-07-04&searchTerm=Northern I&house=Commons&includeCommitteeDivisions=False&partial=False&sortOrder=1,Northern Ireland Troubles  (Legacy and Reconciliation) Bill 2022-07-04.txt
1485888,Northern Ireland Troubles (Legacy and Reconciliation) Bill: Third Reading,04/07/2022,https://hansard.parliament.uk/search/Divisions?startDate=2022-07-04&endDate=2022-07-04&searchTerm=Northern I&house=Commons&includeCommitteeDivisions=False&partial=False&sortOrder=1,Northern Ireland Troubles  (Legacy and Reconciliation) Bill 2022-07-04.txt
1485889,draft Slavery and Human Trafficking (Definition of Victim) Regulations 2022,04/07/2022,https://hansard.parliament.uk/search/Divisions?startDate=2022-07-04&endDate=2022-07-04&searchTerm=draft Slav&house=Commons&includeCommitteeDivisions=False&partial=False&sortOrder=1,
1484606,Northern Ireland Troubles (Legacy and Reconciliation) Bill Committee: Amendment 97,29/06/2022,https://hansard.parliament.uk/search/Divisions?startDate=2022-06-29&endDate=2022-06-29&searchTerm=Northern I&house=Commons&includeCommitteeDivisions=False&partial=False&sortOrder=1,Northern Ireland Troubles (Legacy and Reconciliation) Bill 2022-06-29.txt
1484607,Northern Ireland Troubles (Legacy and Reconciliation) Bill Committee:Amendment 98,29/06/2022,https://hansard.parliament.uk/search/Divisions?startDate=2022-06-29&endDate=2022-06-29&searchTerm=Northern I&house=Commons&includeCommitteeDivisions=False&partial=False&sortOrder=1,Northern Ireland Troubles (Legacy and Reconciliation) Bill 2022-06-29.txt
1484608,Northern Ireland Troubles (Legacy and Reconciliation) Bill Committee: Clauses 18 to 25 etc. stand part,29/06/2022,https://hansard.parliament.uk/search/Divisions?startDate=2022-06-29&endDate=2022-06-29&searchTerm=Northern I&house=Commons&includeCommitteeDivisions=False&partial=False&sortOrder=1,Northern Ireland Troubles (Legacy and Reconciliation) Bill 2022-06-29.txt
1483348,Northern Ireland Protocol Bill: Second Reading ,27/06/2022,https://hansard.parliament.uk/search/Divisions?startDate=2022-06-27&endDate=2022-06-27&searchTerm=Northern I&house=Commons&includeCommitteeDivisions=False&partial=False&sortOrder=1,Northern Ireland Protocol Bill 2022-06-27.txt
1472398,"Abortion (Northern Ireland) Regulations 2022 (SI, 2022, No. 554)",22/06/2022,https://hansard.parliament.uk/search/Divisions?startDate=2022-06-22&endDate=2022-06-22&searchTerm=Abortion (&house=Commons&includeCommitteeDivisions=False&partial=False&sortOrder=1,
1471929,Opposition Day: Adviser on Ministerial Interests,21/06/2022,https://hansard.parliament.uk/search/Divisions?startDate=2022-06-21&endDate=2022-06-21&searchTerm=Opposition&house=Commons&includeCommitteeDivisions=False&partial=False&sortOrder=1,
1471554,High Speed Rail (Crewe - Manchester) Bill: Second Reading,20/06/2022,https://hansard.parliament.uk/search/Divisions?startDate=2022-06-20&endDate=2022-06-20&searchTerm=High Speed&house=Commons&includeCommitteeDivisions=False&partial=False&sortOrder=1,High Speed Rail (Crewe - Manchester) Bill 2022-06-20.txt
1470541,Rail strikes: Opposition amendment (a),15/06/2022,https://hansard.parliament.uk/search/Divisions?startDate=2022-06-15&endDate=2022-06-15&searchTerm=Rail strik&house=Commons&includeCommitteeDivisions=False&partial=False&sortOrder=1,Rail Strikes 2022-06-15.txt
1470542,Rail strikes (main question),15/06/2022,https://hansard.parliament.uk/search/Divisions?startDate=2022-06-15&endDate=2022-06-15&searchTerm=Rail strik&house=Commons&includeCommitteeDivisions=False&partial=False&sortOrder=1,Rail Strikes 2022-06-15.txt
1470124,Opposition Day: censure Minister for Safe and Legal Migration,14/06/2022,https://hansard.parliament.uk/search/Divisions?startDate=2022-06-14&endDate=2022-06-14&searchTerm=Opposition&house=Commons&includeCommitteeDivisions=False&partial=False&sortOrder=1,
1469591,Higher Education (Freedom of Speech) Bill: Report stage: New Clause 4,13/06/2022,https://hansard.parliament.uk/search/Divisions?startDate=2022-06-13&endDate=2022-06-13&searchTerm=Higher Edu&house=Commons&includeCommitteeDivisions=False&partial=False&sortOrder=1,Higher Education  (Freedom of Speech) Bill 2022-06-13.txt
1469592,Higher Education (Freedom of Speech) Bill Report Stage: Amendment 17,13/06/2022,https://hansard.parliament.uk/search/Divisions?startDate=2022-06-13&endDate=2022-06-13&searchTerm=Higher Edu&house=Commons&includeCommitteeDivisions=False&partial=False&sortOrder=1,Higher Education  (Freedom of Speech) Bill 2022-06-13.txt
1468018,Opposition Day: Standards in public life,07/06/2022,https://hansard.parliament.uk/search/Divisions?startDate=2022-06-07&endDate=2022-06-07&searchTerm=Opposition&house=Commons&includeCommitteeDivisions=False&partial=False&sortOrder=1,
1465659,Product Security and Telecommunications Infrastructure Bill Report Stage: Amendment 14,25/05/2022,https://hansard.parliament.uk/search/Divisions?startDate=2022-05-25&endDate=2022-05-25&searchTerm=Product Se&house=Commons&includeCommitteeDivisions=False&partial=False&sortOrder=1,Product Security and Telecommunications Infrastructure Bill 2022-05-25.txt
1465196,Northern Ireland Troubles (Legacy and Reconciliation) Bill: Second Reading ,24/05/2022,https://hansard.parliament.uk/search/Divisions?startDate=2022-05-24&endDate=2022-05-24&searchTerm=Northern I&house=Commons&includeCommitteeDivisions=False&partial=False&sortOrder=1,Northern Ireland Troubles (Legacy and Reconciliation) Bill 2022-05-24.txt
1464866,Public Order Bill: Reasoned Amendment to Second Reading,23/05/2022,https://hansard.parliament.uk/search/Divisions?startDate=2022-05-23&endDate=2022-05-23&searchTerm=Public Ord&house=Commons&includeCommitteeDivisions=False&partial=False&sortOrder=1,Public Order Bill 2022-05-23.txt
1464880,Public Order Bill: Second Reading,23/05/2022,https://hansard.parliament.uk/search/Divisions?startDate=2022-05-23&endDate=2022-05-23&searchTerm=Public Ord&house=Commons&includeCommitteeDivisions=False&partial=False&sortOrder=1,Public Order Bill 2022-05-23.txt
1463925,Queen's Speech debate (Opposition amendment w),18/05/2022,https://hansard.parliament.uk/search/Divisions?startDate=2022-05-18&endDate=2022-05-18&searchTerm=Queen's Sp&house=Commons&includeCommitteeDivisions=False&partial=False&sortOrder=1,
1463926,Queen's Speech debate (amendment m),18/05/2022,https://hansard.parliament.uk/search/Divisions?startDate=2022-05-18&endDate=2022-05-18&searchTerm=Queen's Sp&house=Commons&includeCommitteeDivisions=False&partial=False&sortOrder=1,
1463927,Queen's Speech debate (amendment s),18/05/2022,https://hansard.parliament.uk/search/Divisions?startDate=2022-05-18&endDate=2022-05-18&searchTerm=Queen's Sp&house=Commons&includeCommitteeDivisions=False&partial=False&sortOrder=1,
1463928,Humble Address (main Question),18/05/2022,https://hansard.parliament.uk/search/Divisions?startDate=2022-05-18&endDate=2022-05-18&searchTerm=Humble Add&house=Commons&includeCommitteeDivisions=False&partial=False&sortOrder=1,
1463455,Queen's Speech debate (Opposition amendment v),17/05/2022,https://hansard.parliament.uk/search/Divisions?startDate=2022-05-17&endDate=2022-05-17&searchTerm=Queen's Sp&house=Commons&includeCommitteeDivisions=False&partial=False&sortOrder=1,
1460546,Elections Bill: Government Motion to disagree to Lords Amendment 22,27/04/2022,https://hansard.parliament.uk/search/Divisions?startDate=2022-04-27&endDate=2022-04-27&searchTerm=Elections &house=Commons&includeCommitteeDivisions=False&partial=False&sortOrder=1,Elections Bill 2022-04-27.txt
1460547,"	Elections Bill: Government Motion to disagree to Lords Amendment 23",27/04/2022,"https://hansard.parliament.uk/search/Divisions?startDate=2022-04-27&endDate=2022-04-27&searchTerm=	Elections&house=Commons&includeCommitteeDivisions=False&partial=False&sortOrder=1",Elections Bill 2022-04-27.txt
1460548,Elections Bill: Government Motion to disagree to Lords Amendment 86,27/04/2022,https://hansard.parliament.uk/search/Divisions?startDate=2022-04-27&endDate=2022-04-27&searchTerm=Elections &house=Commons&includeCommitteeDivisions=False&partial=False&sortOrder=1,Elections Bill 2022-04-27.txt
1460269,Judicial Review and Courts Bill: motion to disagree with Lords Amendment 1,26/04/2022,https://hansard.parliament.uk/search/Divisions?startDate=2022-04-26&endDate=2022-04-26&searchTerm=Judicial R&house=Commons&includeCommitteeDivisions=False&partial=False&sortOrder=1,Judicial Review and Courts Bill 2022-04-26.txt
1460271,Judicial Review and Courts Bill: motion to disagree with Lords Amendment 5,26/04/2022,https://hansard.parliament.uk/search/Divisions?startDate=2022-04-26&endDate=2022-04-26&searchTerm=Judicial R&house=Commons&includeCommitteeDivisions=False&partial=False&sortOrder=1,Judicial Review and Courts Bill 2022-04-26.txt
1460272,Judicial Review and Courts Bill: motion to disagree with Lords Amendment 11,26/04/2022,https://hansard.parliament.uk/search/Divisions?startDate=2022-04-26&endDate=2022-04-26&searchTerm=Judicial R&house=Commons&includeCommitteeDivisions=False&partial=False&sortOrder=1,Judicial Review and Courts Bill 2022-04-26.txt
1460347,Nationality and Borders Bill: motion to disagree with Lords Amendment 5D,26/04/2022,https://hansard.parliament.uk/search/Divisions?startDate=2022-04-26&endDate=2022-04-26&searchTerm=Nationalit&house=Commons&includeCommitteeDivisions=False&partial=False&sortOrder=1,Nationality and Borders Bill 2022-04-26.txt
